[22/9/23, 17:25:44] Maga: ‎Los mensajes y las llamadas están cifrados de extremo a extremo. Nadie fuera de este chat, ni siquiera WhatsApp, puede leerlos ni escucharlos.
[22/9/23, 17:25:44] Antonio Murillo Sevillano: https://maps.app.goo.gl/Tdrzv5EpChmwDpRx7?g_st=iw
‎[23/9/23, 11:34:39] Antonio Murillo Sevillano: ‎imagen omitida
[23/9/23, 11:43:05] Antonio Murillo Sevillano: pasame el numero del vape otra ves
[23/9/23, 11:43:07] Antonio Murillo Sevillano: q lo he perdido
[23/9/23, 14:00:46] Antonio Murillo Sevillano: Pablo squirrel fucker a puntuado bien
[23/9/23, 14:01:05] Maga: Voy
[23/9/23, 14:01:09] Maga: Me acabo de despertar
[23/9/23, 14:01:14] Maga: Vaya noche rara
[23/9/23, 14:01:15] Antonio Murillo Sevillano: Q has hecho
[23/9/23, 14:01:34] Maga: Acabamos en el piso de unas chavalas en el juncal
[23/9/23, 14:01:44] Maga: Esta gente se fue de rave
[23/9/23, 14:01:48] Maga: Y yo pa casa
[23/9/23, 14:01:50] Antonio Murillo Sevillano: Desplegaste magic?
[23/9/23, 14:02:00] Antonio Murillo Sevillano: Despliegue de época
[23/9/23, 14:02:02] Maga: Que va no eran my type
[23/9/23, 14:02:23] Maga: Vamos ni el de ninguno creo yo
[23/9/23, 14:02:33] Maga: Pero bueno
[23/9/23, 14:02:49] Antonio Murillo Sevillano: No eran mujeres ?
[23/9/23, 14:03:28] Maga: Si pero raxetas
[23/9/23, 14:03:53] Maga: La verdad que acabamos más alli x el plan de piso que otra cosa
[23/9/23, 14:03:55] Antonio Murillo Sevillano: Han echado a Pablo y a alex de shine por ser gays
[23/9/23, 14:04:15] Maga: Quienes?
[23/9/23, 14:04:15] Antonio Murillo Sevillano: Polonia tierra de libertades
[23/9/23, 14:04:23] Antonio Murillo Sevillano: Me he pensado en llevarme la soloñac
‎[23/9/23, 14:04:45] Antonio Murillo Sevillano: ‎<adjunto: 00000026-AUDIO-2023-09-23-14-04-45.opus>
[23/9/23, 14:05:06] Maga: Que cojones
[23/9/23, 14:05:45] Maga: Van a poner tu cara x los carteles
[23/9/23, 14:16:09] Antonio Murillo Sevillano: Si
[23/9/23, 14:16:14] Antonio Murillo Sevillano: Hoy te llega el vale
[23/9/23, 14:21:00] Maga: Supuestamente
[23/9/23, 15:44:52] Maga: Ya esta aki
[23/9/23, 15:55:33] Antonio Murillo Sevillano: Lo has abierto ?
[23/9/23, 15:55:43] Antonio Murillo Sevillano: Has mirado la política de devolución
[23/9/23, 15:55:45] Antonio Murillo Sevillano: ?
[23/9/23, 16:03:58] Maga: No he hecho nada
[23/9/23, 16:04:46] Antonio Murillo Sevillano: Haz ya el trifling
[23/9/23, 16:06:01] Maga: Que?
[23/9/23, 16:06:22] Maga: Tengo que esperar a que llegue el de mi hermano y el de la parienta
[23/9/23, 16:13:40] Antonio Murillo Sevillano: Porque
[23/9/23, 16:13:47] Antonio Murillo Sevillano: El tricount
[23/9/23, 16:14:22] Maga: Va
[23/9/23, 16:14:47] Maga: Meteme
[24/9/23, 10:17:57] Antonio Murillo Sevillano: Mi media ha bajado un 4.8
[24/9/23, 10:18:11] Antonio Murillo Sevillano: Era algo que sabía a iba a pasar
[24/9/23, 10:18:25] Antonio Murillo Sevillano: Ahmed se ha portado con un 5
[24/9/23, 10:18:34] Antonio Murillo Sevillano: Los otros follardillas no
[24/9/23, 15:51:57] Antonio Murillo Sevillano: Si no tienes no tienes na q hacer
[24/9/23, 15:52:09] Antonio Murillo Sevillano: Vente a lo q he pasado de la ópera
[24/9/23, 15:52:23] Antonio Murillo Sevillano: Aunq ha este ritmo voy a tener a ponerlo en mejores amigos
[24/9/23, 15:52:27] Maga: Me ha dicho Maria fdez de vernos
[24/9/23, 15:52:43] Antonio Murillo Sevillano: Fuck ligeramente le estaba escribiendo a maría Fernández
[24/9/23, 15:52:46] Antonio Murillo Sevillano: Pa q se venga
[24/9/23, 15:53:33] Maga: Los que dejamos en los pueblos y la sorra niña xika?
[24/9/23, 15:53:44] Antonio Murillo Sevillano: Si
[24/9/23, 15:53:57] Maga: Warra desagradecia
[24/9/23, 15:54:09] Maga: X 12 pavos que les costó
[24/9/23, 16:04:18] Antonio Murillo Sevillano: Ya
[24/9/23, 16:04:21] Antonio Murillo Sevillano: La vd
‎[24/9/23, 16:04:33] Antonio Murillo Sevillano: ‎<adjunto: 00000060-STICKER-2023-09-24-16-04-33.webp>
[24/9/23, 17:12:11] Maga: Tienes solo una entrada no?
[24/9/23, 17:12:27] Antonio Murillo Sevillano: No
[24/9/23, 17:12:33] Antonio Murillo Sevillano: Pero eres culo veo culo kiero
‎[24/9/23, 17:12:40] Antonio Murillo Sevillano: ‎<adjunto: 00000064-STICKER-2023-09-24-17-12-40.webp>
[24/9/23, 17:12:44] Antonio Murillo Sevillano: Vente si quieres
[24/9/23, 17:12:45] Maga: No quiero ir xurri
[24/9/23, 17:12:52] Maga: Toy tieso
[24/9/23, 17:12:55] Antonio Murillo Sevillano: Tengo infinitas
[24/9/23, 17:13:03] Antonio Murillo Sevillano: Total puedo meter a qn sea
[24/9/23, 17:13:08] Maga: Pero maria me ha dicho nojeq del centro
[24/9/23, 17:13:16] Maga: Y me has robao el plan
[24/9/23, 17:14:27] Antonio Murillo Sevillano: He mejorado tu puja
[24/9/23, 17:14:44] Maga: A ver mi puja era vernos
[24/9/23, 17:15:25] Maga: But si la puja implica bajar al centro y ver tristan y isolda la verdad que no pujo
[24/9/23, 17:32:12] Maga: A que hora acaba?
[24/9/23, 18:12:18] Antonio Murillo Sevillano: Tengo que mirarlo
[24/9/23, 19:02:33] Antonio Murillo Sevillano: Vente en metro
[24/9/23, 19:02:36] Antonio Murillo Sevillano: Yo traigo coche
[24/9/23, 19:02:40] Antonio Murillo Sevillano: Son 3 actos
[24/9/23, 19:02:48] Antonio Murillo Sevillano: Si nos aburrimos nos salimos antes
[24/9/23, 19:03:01] Maga: Venga
[24/9/23, 19:03:11] Maga: Avisame cuando tu creas
[24/9/23, 20:59:13] Antonio Murillo Sevillano: Creo q a las 10 y pico poco estamos out
[24/9/23, 20:59:21] Antonio Murillo Sevillano: Nos tomamos algo x Aki no?
[24/9/23, 20:59:23] Antonio Murillo Sevillano: Sureña
[24/9/23, 20:59:40] Maga: Ostia perro q temprano
[24/9/23, 20:59:56] Maga: No te viene mejor a las 11?
[24/9/23, 21:00:03] Maga: Aprovechando el ultimo metro
[24/9/23, 21:01:24] Maga: Yo a esa hora no estoy activo sori
[24/9/23, 21:15:06] Antonio Murillo Sevillano: Komo kieras
[24/9/23, 21:15:11] Antonio Murillo Sevillano: Si prefieres San Juan
[24/9/23, 21:15:14] Antonio Murillo Sevillano: Nos da igual
[24/9/23, 21:16:12] Maga: A esa hora en sj nos vamos a tomar poko un domingo
[24/9/23, 21:16:15] Maga: Si me salgo
[24/9/23, 21:16:49] Maga: En vd me bajo
[24/9/23, 21:17:01] Maga: Nesesito andar pa despejarme
[24/9/23, 21:17:04] Maga: Toy emparre
[24/9/23, 21:19:58] Antonio Murillo Sevillano: Díselo a Belén tambn
[24/9/23, 21:20:01] Antonio Murillo Sevillano: X si quiere
[24/9/23, 21:20:04] Antonio Murillo Sevillano: Porque
[24/9/23, 21:20:07] Antonio Murillo Sevillano: La vieja ?
[24/9/23, 21:27:06] Maga: Hace fresca?
[24/9/23, 21:27:16] Maga: Na
[24/9/23, 21:27:23] Maga: Imagino q es de dormir poco
[24/9/23, 21:27:30] Maga: Pero toy bien irritable
[24/9/23, 21:27:48] Maga: Me va a mandar al carajo de una manera fea pero we
[24/9/23, 21:42:19] Antonio Murillo Sevillano: Ya
[24/9/23, 21:42:28] Antonio Murillo Sevillano: Pero no kiero q piense q no la invitamos
[24/9/23, 21:42:35] Antonio Murillo Sevillano: Nada
[24/9/23, 21:42:37] Antonio Murillo Sevillano: Calle
[24/9/23, 21:42:39] Antonio Murillo Sevillano: Calor
[24/9/23, 21:43:59] Maga: Que le queda a eso
[24/9/23, 21:44:03] Maga: Pa ir saliendo
[24/9/23, 21:55:02] Antonio Murillo Sevillano: Sal ya si kieres
[24/9/23, 21:56:46] Maga: Enga
[24/9/23, 21:58:18] Antonio Murillo Sevillano: Mira si hay de Uber eats algún dos por uno barato e interesante x el centro
[24/9/23, 21:58:23] Antonio Murillo Sevillano: Q me ruge la barriga
[24/9/23, 21:59:50] Maga: Yo acabo de senar
[24/9/23, 22:00:35] Antonio Murillo Sevillano: Va
[24/9/23, 22:00:48] Antonio Murillo Sevillano: Ven ya
[24/9/23, 22:03:23] Maga: Estoy saliendo
[24/9/23, 22:05:57] Antonio Murillo Sevillano: Se lo has dicho a belen ?
[25/9/23, 1:13:44] Antonio Murillo Sevillano: Tienes mi mechero
[25/9/23, 1:13:48] Antonio Murillo Sevillano: No me lo pierdas
[25/9/23, 1:13:58] Antonio Murillo Sevillano: Q es de Ámsterdam
[25/9/23, 1:17:58] Maga: Sii
[25/9/23, 9:44:45] Antonio Murillo Sevillano: ‎Eliminaste este mensaje.
[25/9/23, 11:15:37] Maga: K
[25/9/23, 13:01:24] Antonio Murillo Sevillano: Cuando llega el vape de tu hermano
[25/9/23, 13:01:29] Antonio Murillo Sevillano: El mío ya ha llegado
[25/9/23, 13:02:26] Maga: Queda solo el d mi hermano
[25/9/23, 13:02:35] Maga: El de la novia ha llegado hoy
‎[25/9/23, 13:02:45] Maga: ‎<adjunto: 00000133-AUDIO-2023-09-25-13-02-45.opus>
[25/9/23, 13:52:56] Antonio Murillo Sevillano: Va
[25/9/23, 13:54:50] Antonio Murillo Sevillano: Q motivo puso el colega de tu hermano para devolverlo
[25/9/23, 13:59:05] Maga: No se
[25/9/23, 13:59:08] Maga: Luego le pregunto
[25/9/23, 13:59:49] Maga: Tu dales una buena valoracion en amazon
[25/9/23, 14:00:10] Antonio Murillo Sevillano: En la valoración no tienes q decir q lo has devuelto eh
[25/9/23, 14:00:13] Antonio Murillo Sevillano: Q te veo venir
[25/9/23, 14:01:34] Maga: Hilipollas
[25/9/23, 14:09:32] Antonio Murillo Sevillano: Es q la última ves q lo hablamos cuando dijiste lo q ibas a poner mencionabas q lo devolvías
[25/9/23, 14:11:45] Maga: No
[25/9/23, 14:11:55] Maga: Tu pones que es lapolla
[25/9/23, 14:12:08] Maga: Que vaporisa yerba como un dragón
[25/9/23, 14:12:13] Maga: Y ya lo devuelves
[25/9/23, 14:12:20] Antonio Murillo Sevillano: Ya
[25/9/23, 14:12:28] Maga: Pero lo que no se es si hay un motivo de devolución
[25/9/23, 14:12:28] Antonio Murillo Sevillano: Falta saber el motivo de devolución
[25/9/23, 14:12:34] Antonio Murillo Sevillano: Hay q ponerlo x huevos
[25/9/23, 14:12:43] Antonio Murillo Sevillano: Y todo son un tiro en los huecos
[25/9/23, 14:12:46] Antonio Murillo Sevillano: No hay ninguno de
[25/9/23, 14:12:50] Antonio Murillo Sevillano: Kiero dejar de fumar
[25/9/23, 14:14:18] Maga: No cumple con mis expectativas no hay??
[25/9/23, 14:15:53] Antonio Murillo Sevillano: No
[25/9/23, 14:15:57] Antonio Murillo Sevillano: Esta ya no lo quiero
[25/9/23, 14:18:24] Maga: Ese esta bien
[25/9/23, 14:18:29] Maga: Me han regalao otro
[25/9/23, 15:22:02] Maga: Le he preguntado al colega de mi hermano
[25/9/23, 15:22:13] Maga: Y dice q pon. Lo q quieras en la devolucion
[25/9/23, 15:23:00] Antonio Murillo Sevillano: Va flama
[25/9/23, 18:56:02] Antonio Murillo Sevillano: Le voy a comprar una tartita y velas a Elena
[25/9/23, 18:56:06] Antonio Murillo Sevillano: Asin de sorpresa
[25/9/23, 18:56:20] Antonio Murillo Sevillano: Alguna sugerencia de sabor ?
[25/9/23, 18:58:33] Maga: Cocholate
[25/9/23, 19:44:00] Antonio Murillo Sevillano: El q va a grabar en la urna
[25/9/23, 19:44:03] Antonio Murillo Sevillano: Urba
[25/9/23, 19:44:44] Antonio Murillo Sevillano: Va a ser el mismo director q el de la película De Alva Inger
[25/9/23, 19:46:06] Maga: Bof
[25/9/23, 19:46:16] Maga: A salir a fumar en calzoncillos en la ventana
[25/9/23, 19:51:10] Antonio Murillo Sevillano: Le voy a Desiré
[25/9/23, 19:51:15] Antonio Murillo Sevillano: Desir
[25/9/23, 19:51:18] Antonio Murillo Sevillano: X la vieja contrátame
[25/9/23, 19:51:23] Antonio Murillo Sevillano: Aparte es en mi portal
[25/9/23, 19:55:09] Maga: El que?
[25/9/23, 19:55:18] Maga: No es en la piwi?
[25/9/23, 19:55:25] Antonio Murillo Sevillano: Piwi a es
[25/9/23, 19:55:32] Antonio Murillo Sevillano: En mi portal graban cosas
[25/9/23, 19:55:31] Maga: Pisina
[25/9/23, 19:55:43] Antonio Murillo Sevillano: El otro día estuvieron haciendo pruebas
[25/9/23, 19:56:12] Maga: Ester eposito en el bosque oscuro🤪🤪🤪
[25/9/23, 19:56:25] Antonio Murillo Sevillano: Tú y yo con medio porro de cbd
‎[25/9/23, 19:56:29] Antonio Murillo Sevillano: ‎<adjunto: 00000183-STICKER-2023-09-25-19-56-29.webp>
‎[25/9/23, 19:56:36] Antonio Murillo Sevillano: ‎<adjunto: 00000184-STICKER-2023-09-25-19-56-36.webp>
[25/9/23, 20:07:44] Maga: Si
‎[25/9/23, 20:22:13] Antonio Murillo Sevillano: ‎<adjunto: 00000186-AUDIO-2023-09-25-20-22-13.opus>
[25/9/23, 20:23:17] Antonio Murillo Sevillano: Dale
[26/9/23, 0:38:36] Maga: Mano
[26/9/23, 0:38:41] Maga: Hay cosas turbias
[26/9/23, 0:38:42] Maga: Y luego
[26/9/23, 0:38:56] Maga: Q la amiga de carlota del cumple siga en se va de hippie
[26/9/23, 9:42:23] Antonio Murillo Sevillano: La vd es a no lo había pensando
[26/9/23, 9:43:02] Antonio Murillo Sevillano: 10 de la mañana, patrivargas lleva ya despiertas 5 horas y yo me acabo de levantar
[26/9/23, 9:43:06] Antonio Murillo Sevillano: Madrugada de época
[26/9/23, 10:49:52] Maga: Same
[26/9/23, 10:51:40] Antonio Murillo Sevillano: Pa continuar con mi rutina de español de charca
[26/9/23, 10:51:44] Antonio Murillo Sevillano: Lolito
[26/9/23, 10:51:52] Maga: Bof
[26/9/23, 10:51:54] Antonio Murillo Sevillano: Y gastarme dinero en la parienta
[26/9/23, 10:51:58] Maga: Yo gym
‎[26/9/23, 10:52:03] Antonio Murillo Sevillano: ‎imagen omitida
[26/9/23, 10:52:39] Maga: Soy
‎[26/9/23, 11:58:01] Antonio Murillo Sevillano: ‎<adjunto: 00000203-PHOTO-2023-09-26-11-58-01.jpg>
[26/9/23, 12:02:17] Maga: Max gym mi religion
[26/9/23, 12:19:12] Maga: Le debo al migue muxo
[26/9/23, 12:41:37] Maga: Vaya subida de tension me ha cascado saltando a la comba
[26/9/23, 12:41:39] Maga: Damn
[26/9/23, 12:41:50] Maga: Un dolor de cabeza como si me fuera a esplotar
[26/9/23, 12:41:57] Maga: Tambien esq no he bebio awa en to el dia
[26/9/23, 13:02:09] Maga: Me he werto a la casa
[26/9/23, 13:02:14] Maga: Xq me he quedado to tieso
[26/9/23, 13:02:26] Antonio Murillo Sevillano: Q ha sido primer ejercicio ?
[26/9/23, 13:02:30] Maga: Y me tocaba boxear con golpes poderoso
[26/9/23, 13:02:37] Maga: He hecho ejercicios del tobillo
[26/9/23, 13:02:46] Maga: Con goma y eso
[26/9/23, 13:02:48] Antonio Murillo Sevillano: Press tobillo
[26/9/23, 13:02:53] Antonio Murillo Sevillano: Cual de tobillo
[26/9/23, 13:02:56] Maga: Y he hecho comba a ritmo qeno
[26/9/23, 13:03:04] Antonio Murillo Sevillano: A ve pa cuando un funcional de cara
[26/9/23, 13:04:44] Maga: ‎Se eliminó este mensaje.
‎[26/9/23, 13:06:26] Maga: ‎<adjunto: 00000221-AUDIO-2023-09-26-13-06-26.opus>
[26/9/23, 13:06:48] Maga: Uwu
[26/9/23, 13:17:21] Antonio Murillo Sevillano: Haberle pedido ayuda a Pedro
[26/9/23, 13:17:31] Antonio Murillo Sevillano: Pedro una cocacolita x favo
[26/9/23, 13:18:04] Maga: Ji
[26/9/23, 13:18:10] Maga: Me hace un mataleon
‎[26/9/23, 13:39:41] Antonio Murillo Sevillano: ‎imagen omitida
[26/9/23, 13:40:15] Maga: jajajajajajajajajajajajaha
[26/9/23, 13:40:30] Antonio Murillo Sevillano: Todos los locos me tocan a mi
[26/9/23, 13:40:46] Maga: Pa la yihad
‎[26/9/23, 13:55:59] Antonio Murillo Sevillano: ‎<adjunto: 00000231-PHOTO-2023-09-26-13-55-59.jpg>
[26/9/23, 13:57:29] Maga: Ostia
‎[26/9/23, 14:51:25] Antonio Murillo Sevillano: ‎<adjunto: 00000233-PHOTO-2023-09-26-14-51-25.jpg>
[26/9/23, 15:04:55] Maga: Dile que si no voy yo
[26/9/23, 17:54:50] Antonio Murillo Sevillano: Salte
‎[26/9/23, 17:54:55] Antonio Murillo Sevillano: ‎imagen omitida
[26/9/23, 17:55:06] Antonio Murillo Sevillano: Momento de liarla
[26/9/23, 17:58:41] Antonio Murillo Sevillano: Hay un famoso abajo
[26/9/23, 17:58:57] Maga: Si
[26/9/23, 17:59:02] Maga: Quien
[26/9/23, 17:59:06] Maga: Me lo ha dicho mi vieja
[26/9/23, 17:59:09] Maga: Pero no se
[26/9/23, 17:59:15] Antonio Murillo Sevillano: Un jipi típico de comedia española
[26/9/23, 17:59:31] Maga: Tirale un fotele
[26/9/23, 17:59:37] Maga: Estas abajo?
[26/9/23, 17:59:46] Antonio Murillo Sevillano: Me he subido
[26/9/23, 18:00:00] Antonio Murillo Sevillano: Vamos he pasado como si fuese mi casa
[26/9/23, 18:00:02] Antonio Murillo Sevillano: Sin decir na
[26/9/23, 18:00:07] Antonio Murillo Sevillano: Stay x tirar un cubo con sea
[26/9/23, 18:00:09] Maga: https://spotify.link/87ZLm9DBpDb
[26/9/23, 18:00:09] Antonio Murillo Sevillano: Agua
[26/9/23, 18:00:15] Maga: Es una ia
[26/9/23, 18:00:30] Maga: Hay una a la q le han dao 3000 lereles x grabar en su casa
[26/9/23, 18:00:37] Antonio Murillo Sevillano: Quien
[26/9/23, 18:00:42] Antonio Murillo Sevillano: Q le dejo la mía
[26/9/23, 18:00:48] Antonio Murillo Sevillano: Con mi viejo dentro
[26/9/23, 18:00:49] Maga: Una del patio de los mosquitos
[26/9/23, 18:00:59] Antonio Murillo Sevillano: No controlo los nombres esos
[26/9/23, 18:02:08] Antonio Murillo Sevillano: A la urba le han dado 4K
[26/9/23, 18:02:13] Antonio Murillo Sevillano: q mal negocian
[26/9/23, 18:03:51] Antonio Murillo Sevillano: Yo kiero ser actor
[26/9/23, 18:03:57] Maga: Mi vieja dice q ella queria 1k x dia de grabacion
[26/9/23, 18:04:02] Antonio Murillo Sevillano: Si no fuese porque me voy
[26/9/23, 18:04:04] Maga: Hay alguna diablona abajo?
[26/9/23, 18:04:14] Antonio Murillo Sevillano: Me lo camelo
[26/9/23, 18:04:28] Antonio Murillo Sevillano: La prota está bien
[26/9/23, 18:04:30] Antonio Murillo Sevillano: Total
[26/9/23, 18:04:32] Antonio Murillo Sevillano: Son actores
[26/9/23, 18:04:35] Antonio Murillo Sevillano: Hasta los feos
[26/9/23, 18:04:37] Antonio Murillo Sevillano: Son feos guapos
[26/9/23, 18:04:44] Antonio Murillo Sevillano: Son feos well made
[26/9/23, 18:04:59] Maga: Mi bro q no memoriza una cancion y no puede contar la historia de la porra sin reirse
[26/9/23, 18:05:10] Maga: Lit
[26/9/23, 18:05:14] Antonio Murillo Sevillano: Lo de la porra si puedo
[26/9/23, 18:05:18] Antonio Murillo Sevillano: Peores mentiras he contado
[26/9/23, 18:05:18] Maga: Son fros cuidados
[26/9/23, 18:05:39] Maga: La siguiente vez la cuentas tu
[26/9/23, 18:06:10] Antonio Murillo Sevillano: Verás
[26/9/23, 18:06:14] Antonio Murillo Sevillano: Q hasta cuela mas
[26/9/23, 18:07:16] Maga: Hermano la cuento d exquisitas maneras
[26/9/23, 18:07:24] Maga: Lo q pasa esq no me queda a quien contarla
[26/9/23, 18:07:39] Maga: Tiene un porcentaje de acierto del 95%
[26/9/23, 18:08:17] Antonio Murillo Sevillano: Hombre te la sabes mejor q el abc
[26/9/23, 18:08:25] Antonio Murillo Sevillano: La has contado 200 veces
[26/9/23, 18:09:25] Maga: Yo a mi suegro contandole el dia q un policia nos paro en la puerta del estanco😝
[26/9/23, 18:09:45] Antonio Murillo Sevillano: Es de coña q me voy yo
[26/9/23, 18:09:51] Antonio Murillo Sevillano: Y pasan cosas
[26/9/23, 18:10:06] Antonio Murillo Sevillano: Los latin Grammy
[26/9/23, 18:10:08] Antonio Murillo Sevillano: La película
[26/9/23, 18:10:12] Maga: Lit
[26/9/23, 18:10:12] Antonio Murillo Sevillano: Miguelito encarando mujeres
[26/9/23, 18:10:24] Antonio Murillo Sevillano: Diego doblete
‎[26/9/23, 18:11:02] Maga: ‎<adjunto: 00000293-GIF-2023-09-26-18-11-02.mp4>
[26/9/23, 18:11:04] Maga: Sj cuando vuelvas
[26/9/23, 18:28:01] Antonio Murillo Sevillano: ya la ha liado lurike x nosotros
[26/9/23, 18:28:16] Antonio Murillo Sevillano: se ha puesto a tocar como si las teclas fuesen tetas
[26/9/23, 18:28:47] Maga: JAJAJAJAJAJA
[26/9/23, 18:29:02] Antonio Murillo Sevillano: y han tenido q llamar a mi kelo
[26/9/23, 18:29:04] Antonio Murillo Sevillano: pa le bajase
[26/9/23, 18:41:11] Maga: Tocando la tusa
[26/9/23, 20:03:06] Antonio Murillo Sevillano: http://portalvirtualempleo.us.es/x-feria-de-empleo-de-la-universidad-de-sevilla/
[26/9/23, 20:03:15] Antonio Murillo Sevillano: Vamos ?
‎[26/9/23, 20:12:17] Maga: ‎<adjunto: 00000303-AUDIO-2023-09-26-20-12-17.opus>
[26/9/23, 20:13:00] Antonio Murillo Sevillano: Q dia ?
[26/9/23, 20:13:03] Antonio Murillo Sevillano: Mañana o pasado
[26/9/23, 20:13:39] Antonio Murillo Sevillano: Hay por la mañana y por la tarde
[26/9/23, 20:20:07] Maga: Pasao
‎[26/9/23, 20:20:18] Maga: ‎<adjunto: 00000308-AUDIO-2023-09-26-20-20-18.opus>
[26/9/23, 20:25:59] Antonio Murillo Sevillano: A q hora tienes las clases
[26/9/23, 20:26:01] Antonio Murillo Sevillano: Mañana
[26/9/23, 20:26:12] Antonio Murillo Sevillano: Eso está desde las 10
‎[27/9/23, 10:03:15] Antonio Murillo Sevillano: ‎<adjunto: 00000312-AUDIO-2023-09-27-10-03-14.opus>
‎[27/9/23, 11:22:20] Antonio Murillo Sevillano: ‎imagen omitida
[27/9/23, 11:24:09] Maga: Cuando el ekilio salga en calzoncillos peleandose con el padre ya se les pasara
[27/9/23, 11:24:23] Maga: Poco les hemos cobrado
‎[27/9/23, 12:43:32] Maga: ‎<adjunto: 00000316-AUDIO-2023-09-27-12-43-32.opus>
[27/9/23, 12:44:26] Antonio Murillo Sevillano: Vamos mañana x la tarde
[27/9/23, 12:44:36] Antonio Murillo Sevillano: O hoy x la tarde
[27/9/23, 12:44:42] Antonio Murillo Sevillano: O mañana a partir de las 11 y media creo
‎[27/9/23, 12:46:04] Maga: ‎<adjunto: 00000320-AUDIO-2023-09-27-12-46-04.opus>
[27/9/23, 12:49:19] Antonio Murillo Sevillano: Hoy no tenias x la mañana ?
‎[27/9/23, 12:51:59] Maga: ‎<adjunto: 00000322-AUDIO-2023-09-27-12-51-59.opus>
‎[27/9/23, 12:54:19] Maga: ‎<adjunto: 00000323-AUDIO-2023-09-27-12-54-19.opus>
[27/9/23, 12:54:55] Antonio Murillo Sevillano: Serán stants de empresas y de la uni
[27/9/23, 12:55:44] Maga: Ofertando trabajo?
[27/9/23, 12:56:06] Antonio Murillo Sevillano: Más o menos
‎[27/9/23, 12:57:43] Maga: ‎<adjunto: 00000327-AUDIO-2023-09-27-12-57-43.opus>
[27/9/23, 13:27:28] Antonio Murillo Sevillano: Son stants de empresas
[27/9/23, 13:27:30] Antonio Murillo Sevillano: Y de la uni
[27/9/23, 13:35:52] Maga: A kien le has dicho lo de bodeguita
[27/9/23, 13:36:05] Maga: Xq toy hablando con mari fdez
[27/9/23, 13:36:17] Antonio Murillo Sevillano: Díselo tambn
[27/9/23, 13:36:22] Antonio Murillo Sevillano: Pero ella va en el turno de mañana
[27/9/23, 13:36:44] Maga: Ah entonse na
[27/9/23, 13:37:01] Maga: Yo me creia que mañana era parienta
[27/9/23, 13:39:36] Antonio Murillo Sevillano: Era ayer
[27/9/23, 13:40:05] Maga: Ya no la ves mais?
[27/9/23, 13:41:20] Antonio Murillo Sevillano: Hoy se viene creo
[27/9/23, 13:41:26] Antonio Murillo Sevillano: Y el viernes pa desayunar
‎[27/9/23, 14:04:52] Maga: ‎<adjunto: 00000340-AUDIO-2023-09-27-14-04-52.opus>
‎[27/9/23, 14:05:06] Maga: ‎<adjunto: 00000341-AUDIO-2023-09-27-14-05-06.opus>
‎[27/9/23, 14:06:34] Maga: ‎<adjunto: 00000342-AUDIO-2023-09-27-14-06-34.opus>
‎[27/9/23, 14:08:06] Maga: ‎<adjunto: 00000343-AUDIO-2023-09-27-14-08-06.opus>
[27/9/23, 14:10:19] Antonio Murillo Sevillano: metelo tu
[27/9/23, 14:10:22] Antonio Murillo Sevillano: en el tricount
[27/9/23, 14:10:27] Antonio Murillo Sevillano: q lo tengo en el otro movil
[27/9/23, 14:10:37] Antonio Murillo Sevillano: la discotec la pague yo
[27/9/23, 14:10:44] Antonio Murillo Sevillano: la gasolina de vuelta tambn la puse yo
‎[27/9/23, 14:11:15] Maga: ‎<adjunto: 00000349-AUDIO-2023-09-27-14-11-15.opus>
[27/9/23, 14:11:56] Antonio Murillo Sevillano: voy a ver como te lo puedo mandar
‎[27/9/23, 14:12:17] Maga: ‎<adjunto: 00000351-AUDIO-2023-09-27-14-12-17.opus>
[27/9/23, 14:14:21] Antonio Murillo Sevillano: te  lo he enviado x gmail
[27/9/23, 14:16:45] Maga: La gasofa habra q hacerla aparte
[27/9/23, 14:16:59] Maga: Creo yo
[27/9/23, 14:19:16] Antonio Murillo Sevillano: ahora veo
[27/9/23, 14:19:35] Maga: Sin gas
[27/9/23, 14:19:46] Maga: Se queda en 5 pa mi
[27/9/23, 14:20:13] Maga: Y cuanto has sacao de bla blacat
[27/9/23, 14:20:28] Maga: En ese coche hemos metido 50 euros
[27/9/23, 14:20:34] Maga: Sin contar lo q tenia
[27/9/23, 14:20:57] Maga: 30 pa la vuelta y 20 en la ida
[27/9/23, 14:59:37] Maga: Vente ahora a la casa
[27/9/23, 14:59:44] Maga: Llevate los tape
[27/9/23, 15:00:02] Maga: Y dale coaching informatico a mi viejo
[27/9/23, 15:08:16] Antonio Murillo Sevillano: De a
[27/9/23, 15:08:27] Antonio Murillo Sevillano: 48
[27/9/23, 15:08:41] Antonio Murillo Sevillano: De q
[27/9/23, 15:08:56] Antonio Murillo Sevillano: Le he pasado a una cachorrilla tu contacto
[27/9/23, 15:11:53] Antonio Murillo Sevillano: pa trabajar
[27/9/23, 15:11:58] Antonio Murillo Sevillano: me llueven los trabajos ahora q me voty
[27/9/23, 15:12:01] Antonio Murillo Sevillano: acojonante
[27/9/23, 15:20:56] Maga: De que
[27/9/23, 15:21:07] Antonio Murillo Sevillano: striper
[27/9/23, 15:21:11] Maga: Bof
[27/9/23, 15:21:15] Maga: Nasi para eso
[27/9/23, 15:21:17] Antonio Murillo Sevillano: Hola! soy Patricia de Workout. Tenemos tu cv a través de Yobalia. 

Tenemos este trabajo: 

*Sábado 30 Septiembre* en Sevilla:
- 8 riders (chicos) dando vueltas por la ciudad con unas bicis que les proporcionaremos, en horario de 12h a 20h. Salario: 9 euros hora
- 5 azafatas en horario de 12 a 21h. Salario: 8 euros hora

¿Puedes?
[27/9/23, 15:21:31] Antonio Murillo Sevillano: la palabra striper esta en desuso
[27/9/23, 15:21:41] Antonio Murillo Sevillano: habria q darle mas caña
[27/9/23, 15:22:18] Maga: Bof
[27/9/23, 15:22:27] Maga: Tu que eres
[27/9/23, 15:22:32] Maga: Rider
[27/9/23, 15:22:36] Antonio Murillo Sevillano: he tenido q cambiarte el nombre de maga a miguel pa q no se peinse
[27/9/23, 15:22:40] Maga: O azafato
[27/9/23, 15:22:52] Antonio Murillo Sevillano: yo no soy na pq estoy en polonia fumando mojado
[27/9/23, 15:23:04] Maga: Bof
[27/9/23, 15:23:06] Maga: Y yo q soy
[27/9/23, 15:23:12] Maga: Yo rider creo q no puedo
[27/9/23, 15:23:17] Maga: Por el tobillo
[27/9/23, 15:23:33] Antonio Murillo Sevillano: sera rider chill
[27/9/23, 15:23:36] Maga: Son muchas horas
[27/9/23, 15:23:38] Antonio Murillo Sevillano: no se ni en q consiste la vd
[27/9/23, 15:23:42] Antonio Murillo Sevillano: dps me meto en el anuncio
[27/9/23, 15:53:51] Maga: Me van a hablar???
[27/9/23, 15:55:08] Antonio Murillo Sevillano: Alomejor
[27/9/23, 15:55:10] Antonio Murillo Sevillano: No se
[27/9/23, 15:56:45] Maga: Ts😞
‎[27/9/23, 16:25:15] Maga: ‎<adjunto: 00000397-PHOTO-2023-09-27-16-25-15.jpg>
[27/9/23, 16:25:36] Antonio Murillo Sevillano: Q tienen esos guantes ?
[27/9/23, 16:25:56] Maga: Los venum?
[27/9/23, 16:26:07] Maga: O los guantes d muay?
‎[27/9/23, 16:26:36] Maga: ‎<adjunto: 00000401-AUDIO-2023-09-27-16-26-36.opus>
‎[27/9/23, 16:27:14] Maga: ‎<adjunto: 00000402-AUDIO-2023-09-27-16-27-14.opus>
[27/9/23, 16:28:50] Antonio Murillo Sevillano: Si
‎[27/9/23, 16:29:45] Maga: ‎<adjunto: 00000404-AUDIO-2023-09-27-16-29-45.opus>
‎[27/9/23, 16:30:00] Maga: ‎<adjunto: 00000405-AUDIO-2023-09-27-16-30-00.opus>
‎[27/9/23, 17:56:04] Antonio Murillo Sevillano: ‎imagen omitida
[27/9/23, 18:00:26] Antonio Murillo Sevillano: No se como cárajo
[27/9/23, 18:00:37] Antonio Murillo Sevillano: Me fume el paquete ese
[27/9/23, 18:29:02] Antonio Murillo Sevillano: Le he dado dos calos y me he quedado tieso
‎[27/9/23, 18:48:24] Maga: ‎<adjunto: 00000410-AUDIO-2023-09-27-18-48-24.opus>
[27/9/23, 19:39:06] Maga: Yo me ducho y cago y estoy ready
[27/9/23, 19:39:20] Antonio Murillo Sevillano: vengaa
[27/9/23, 19:39:27] Maga: Si quieres ir tu antes ve
[27/9/23, 19:40:09] Antonio Murillo Sevillano: nono
[27/9/23, 19:40:10] Antonio Murillo Sevillano: me espero
[27/9/23, 19:54:50] Antonio Murillo Sevillano: Q te queda
‎[27/9/23, 19:55:20] Maga: ‎<adjunto: 00000417-AUDIO-2023-09-27-19-55-20.opus>
[27/9/23, 19:55:42] Antonio Murillo Sevillano: Q le pasa
[27/9/23, 19:55:43] Antonio Murillo Sevillano: Venga
[27/9/23, 19:55:46] Antonio Murillo Sevillano: Vamos en mi coche
[27/9/23, 19:57:52] Maga: Va
‎[27/9/23, 19:58:00] Maga: ‎<adjunto: 00000422-AUDIO-2023-09-27-19-58-00.opus>
‎[27/9/23, 19:58:16] Maga: ‎<adjunto: 00000423-AUDIO-2023-09-27-19-58-16.opus>
[27/9/23, 20:06:35] Maga: Amo
[27/9/23, 20:06:38] Maga: ?
[27/9/23, 20:07:21] Antonio Murillo Sevillano: Si
[27/9/23, 20:07:27] Antonio Murillo Sevillano: Mi carro y os volvéis en metro ?
[27/9/23, 20:08:53] Maga: Na cojo el mio
[27/9/23, 20:11:50] Antonio Murillo Sevillano: Feka
[27/9/23, 20:11:54] Antonio Murillo Sevillano: Dps me dices q lo ponga yo
[27/9/23, 20:12:00] Antonio Murillo Sevillano: Marikona
‎[27/9/23, 20:19:18] Maga: ‎<adjunto: 00000432-AUDIO-2023-09-27-20-19-18.opus>
‎[27/9/23, 20:19:30] Maga: ‎<adjunto: 00000433-AUDIO-2023-09-27-20-19-30.opus>
[27/9/23, 20:20:03] Antonio Murillo Sevillano: Alérgico al metro
[28/9/23, 8:10:14] Antonio Murillo Sevillano: Ciao! Sto andando ad un centro commerciale vicino al centro a fare un giro e mangiare qualcosa, se vuoi ci becchiamo
[28/9/23, 8:10:14] Antonio Murillo Sevillano: Galeria krakowska
[28/9/23, 8:10:14] Antonio Murillo Sevillano: Devo andare in quel Mediaworld io
[28/9/23, 8:10:14] Antonio Murillo Sevillano: Grande, ci becchiamo lì? Io arrivo tra 10 minuti
[28/9/23, 8:10:24] Antonio Murillo Sevillano: Parece un luto listening
[28/9/23, 8:59:11] Antonio Murillo Sevillano: Me debes 6.5
[28/9/23, 9:04:36] Antonio Murillo Sevillano: Los congresos también dan ganas de trabajar la vd
[28/9/23, 10:59:35] Maga: Qué es??
[28/9/23, 10:59:39] Maga: Quien
[28/9/23, 10:59:50] Maga: Tu compi?
[28/9/23, 10:59:50] Antonio Murillo Sevillano: Uno del grupo de erasmus
[28/9/23, 10:59:56] Antonio Murillo Sevillano: Random
[28/9/23, 10:59:59] Antonio Murillo Sevillano: Compi no tengo
‎[28/9/23, 11:00:12] Antonio Murillo Sevillano: ‎imagen omitida
[28/9/23, 11:00:48] Antonio Murillo Sevillano: Más manoseado q Diego en rosso estoy
[28/9/23, 11:02:33] Maga: Estas ahora alli??
[28/9/23, 11:02:40] Maga: Con los médicos delante?
[28/9/23, 11:24:29] Antonio Murillo Sevillano: Si
[28/9/23, 11:24:38] Antonio Murillo Sevillano: Era como un taller rotativo
[28/9/23, 11:24:47] Antonio Murillo Sevillano: Me be comido la misma chapa 4 veces
[28/9/23, 11:26:38] Maga: Que haces con el phone
[28/9/23, 11:26:51] Antonio Murillo Sevillano: Soy modelo de ecógrafos
[28/9/23, 11:26:59] Antonio Murillo Sevillano: No esclavo
[28/9/23, 11:26:59] Maga: Tienes algo malo?
[28/9/23, 11:27:06] Maga: 😝
[28/9/23, 11:27:12] Antonio Murillo Sevillano: Toy como un toro
[28/9/23, 11:27:19] Antonio Murillo Sevillano: Dice q siga fumando
‎[28/9/23, 11:27:34] Maga: ‎<adjunto: 00000462-AUDIO-2023-09-28-11-27-34.opus>
[28/9/23, 11:27:51] Antonio Murillo Sevillano: Lo he hecho x seur
[28/9/23, 11:27:54] Antonio Murillo Sevillano: Pregúntale q porque
[28/9/23, 11:28:01] Maga: Xq cobran
[28/9/23, 11:28:08] Antonio Murillo Sevillano: No cobran
[28/9/23, 11:28:11] Antonio Murillo Sevillano: Ninguno de los 2
‎[28/9/23, 11:28:17] Maga: ‎<adjunto: 00000468-AUDIO-2023-09-28-11-28-17.opus>
[28/9/23, 11:28:26] Maga: Algo de eso era
‎[28/9/23, 11:28:43] Antonio Murillo Sevillano: ‎<adjunto: 00000470-AUDIO-2023-09-28-11-28-43.opus>
‎[28/9/23, 11:28:56] Antonio Murillo Sevillano: ‎<adjunto: 00000471-AUDIO-2023-09-28-11-28-56.opus>
[28/9/23, 11:30:28] Maga: Ah bueno
[28/9/23, 11:30:45] Maga: Po noje
[28/9/23, 11:30:54] Maga: Ya ha llegado el de mi hermano
[28/9/23, 11:31:06] Maga: Desde donde gestiono la devolucion??
[28/9/23, 11:31:08] Antonio Murillo Sevillano: El doctor q me ha tocado a mi q daba mi taller , director de orquesta :
Madrileño y médico, Dios si castiga 2 veces 
Me llama Santiago (5 veces)
-“tu no cobras nada por esto no?”
[28/9/23, 11:31:28] Antonio Murillo Sevillano: Amazon
[28/9/23, 11:31:34] Maga: Hijodeputa
‎[28/9/23, 11:54:20] Antonio Murillo Sevillano: ‎<adjunto: 00000479-PHOTO-2023-09-28-11-54-20.jpg>
‎[28/9/23, 11:54:28] Antonio Murillo Sevillano: ‎<adjunto: 00000480-AUDIO-2023-09-28-11-54-27.opus>
[28/9/23, 12:00:01] Maga: Marcha atras
[28/9/23, 12:00:26] Maga: A quemar embrague
[28/9/23, 12:10:18] Antonio Murillo Sevillano: No
[28/9/23, 12:10:21] Antonio Murillo Sevillano: Se ha quedado hay
[28/9/23, 12:10:50] Maga: Que has hecho?
‎[28/9/23, 12:11:02] Antonio Murillo Sevillano: ‎<adjunto: 00000486-AUDIO-2023-09-28-12-11-02.opus>
‎[28/9/23, 12:11:25] Maga: ‎<adjunto: 00000487-AUDIO-2023-09-28-12-11-25.opus>
‎[28/9/23, 12:11:25] Antonio Murillo Sevillano: ‎<adjunto: 00000488-AUDIO-2023-09-28-12-11-25.opus>
‎[28/9/23, 12:11:47] Antonio Murillo Sevillano: ‎<adjunto: 00000489-AUDIO-2023-09-28-12-11-47.opus>
‎[28/9/23, 12:11:54] Maga: ‎<adjunto: 00000490-AUDIO-2023-09-28-12-11-54.opus>
‎[28/9/23, 12:12:18] Antonio Murillo Sevillano: ‎<adjunto: 00000491-AUDIO-2023-09-28-12-12-18.opus>
‎[28/9/23, 12:12:25] Maga: ‎<adjunto: 00000492-AUDIO-2023-09-28-12-12-25.opus>
‎[28/9/23, 12:12:32] Antonio Murillo Sevillano: ‎<adjunto: 00000493-AUDIO-2023-09-28-12-12-32.opus>
‎[28/9/23, 12:12:49] Maga: ‎<adjunto: 00000494-AUDIO-2023-09-28-12-12-49.opus>
‎[28/9/23, 12:12:53] Antonio Murillo Sevillano: ‎<adjunto: 00000495-AUDIO-2023-09-28-12-12-53.opus>
‎[28/9/23, 12:12:58] Maga: ‎<adjunto: 00000496-AUDIO-2023-09-28-12-12-58.opus>
‎[28/9/23, 12:13:10] Antonio Murillo Sevillano: ‎<adjunto: 00000497-AUDIO-2023-09-28-12-13-10.opus>
[28/9/23, 12:13:26] Maga: Ea po ha sio x paho
‎[28/9/23, 12:13:30] Antonio Murillo Sevillano: ‎<adjunto: 00000499-AUDIO-2023-09-28-12-13-30.opus>
‎[28/9/23, 12:14:00] Maga: ‎<adjunto: 00000500-AUDIO-2023-09-28-12-14-00.opus>
‎[28/9/23, 12:14:30] Antonio Murillo Sevillano: ‎<adjunto: 00000501-AUDIO-2023-09-28-12-14-30.opus>
‎[28/9/23, 12:14:44] Antonio Murillo Sevillano: ‎<adjunto: 00000502-AUDIO-2023-09-28-12-14-44.opus>
‎[28/9/23, 12:16:27] Maga: ‎<adjunto: 00000503-AUDIO-2023-09-28-12-16-27.opus>
[28/9/23, 12:17:05] Antonio Murillo Sevillano: A ve no se esta tocando
[28/9/23, 12:17:12] Antonio Murillo Sevillano: Cabe un meñique
[28/9/23, 12:17:19] Antonio Murillo Sevillano: Feo el
[28/9/23, 12:17:24] Antonio Murillo Sevillano: Q es un cabron
[28/9/23, 12:17:35] Antonio Murillo Sevillano: O si no haberle dado más para atrás
[28/9/23, 12:17:36] Maga: No mano
[28/9/23, 12:17:41] Antonio Murillo Sevillano: Para q no hubiese entrado
[28/9/23, 12:17:46] Antonio Murillo Sevillano: Si vas a hacerlo hazlo bien
‎[28/9/23, 12:18:22] Maga: ‎<adjunto: 00000512-AUDIO-2023-09-28-12-18-22.opus>
‎[28/9/23, 12:18:34] Maga: ‎<adjunto: 00000513-AUDIO-2023-09-28-12-18-34.opus>
[28/9/23, 12:19:19] Antonio Murillo Sevillano: Es q la calle no es suya
[28/9/23, 12:19:23] Antonio Murillo Sevillano: Hay caben 2 coches
[28/9/23, 12:19:31] Antonio Murillo Sevillano: Otra cosa es q le haya dado x ponerlo en medio
‎[28/9/23, 12:20:44] Maga: ‎<adjunto: 00000517-AUDIO-2023-09-28-12-20-44.opus>
‎[28/9/23, 12:21:04] Maga: ‎<adjunto: 00000518-AUDIO-2023-09-28-12-21-04.opus>
[28/9/23, 12:21:16] Maga: Lo has hecho sabiendo lo q hay
‎[28/9/23, 12:21:47] Antonio Murillo Sevillano: ‎<adjunto: 00000520-AUDIO-2023-09-28-12-21-47.opus>
‎[28/9/23, 12:22:09] Antonio Murillo Sevillano: ‎<adjunto: 00000521-AUDIO-2023-09-28-12-22-09.opus>
[28/9/23, 12:23:37] Antonio Murillo Sevillano: Tú esta tarde tienes clase ?
‎[28/9/23, 12:23:46] Maga: ‎<adjunto: 00000523-AUDIO-2023-09-28-12-23-46.opus>
[28/9/23, 12:23:55] Maga: De 4 a 6
‎[28/9/23, 12:24:32] Antonio Murillo Sevillano: ‎<adjunto: 00000525-AUDIO-2023-09-28-12-24-32.opus>
‎[28/9/23, 12:24:55] Antonio Murillo Sevillano: ‎<adjunto: 00000526-AUDIO-2023-09-28-12-24-54.opus>
‎[28/9/23, 12:25:39] Maga: ‎<adjunto: 00000527-AUDIO-2023-09-28-12-25-39.opus>
[28/9/23, 12:26:21] Maga: Xk
[28/9/23, 12:26:23] Antonio Murillo Sevillano: Una cosa es q le salga bien y otra q haga bien
[28/9/23, 12:26:27] Antonio Murillo Sevillano: Pa q me lleves
‎[28/9/23, 12:26:38] Maga: ‎<adjunto: 00000531-AUDIO-2023-09-28-12-26-38.opus>
[28/9/23, 12:27:26] Antonio Murillo Sevillano: Cómo no vas ido veces en carro
‎[28/9/23, 13:28:02] Maga: ‎<adjunto: 00000533-AUDIO-2023-09-28-13-28-02.opus>
[28/9/23, 16:49:13] Antonio Murillo Sevillano: Buenas tardes familia necesito Chicos/hombres/masculinos con B2 de inglés para el 
04 de 07:30 a 18:00
05 de 07:30 a 17:30
06 de 07:30 a 13:30
[28/9/23, 16:49:13] Antonio Murillo Sevillano: dile a miguel q no es seguro
[28/9/23, 16:49:13] Antonio Murillo Sevillano: pero q si me lo dice rápido cabe posibilidadad
[28/9/23, 16:49:13] Antonio Murillo Sevillano: de q pueda trabajar
[28/9/23, 16:49:13] Antonio Murillo Sevillano: y si puede claro
[28/9/23, 16:59:34] Maga: No estoy
[28/9/23, 16:59:40] Maga: Estoy en italia
[28/9/23, 16:59:45] Maga: Me cago en mis muertossss
[28/9/23, 16:59:55] Maga: JODERRRRR
[28/9/23, 17:01:54] Antonio Murillo Sevillano: La vd q eran sendos dineros
[28/9/23, 17:01:58] Antonio Murillo Sevillano: Porque eran sendas horas
[28/9/23, 17:02:51] Antonio Murillo Sevillano: 26 horas
[28/9/23, 17:02:52] Antonio Murillo Sevillano: Creo
[28/9/23, 17:05:26] Maga: Shitttt
[28/9/23, 17:05:30] Maga: Los grillz
[28/9/23, 17:05:36] Maga: Me los iba a pone
[28/9/23, 17:05:42] Maga: Blanco y verde
[28/9/23, 17:19:09] Antonio Murillo Sevillano: Ya entiendo porque no coges el metro
[28/9/23, 17:34:54] Maga: Xq
[28/9/23, 17:35:13] Maga: Ya has recogido el coche?
‎[28/9/23, 18:55:55] Antonio Murillo Sevillano: ‎<adjunto: 00000554-PHOTO-2023-09-28-18-55-55.jpg>
[28/9/23, 18:55:55] Antonio Murillo Sevillano: Están grabando
[28/9/23, 18:55:55] Antonio Murillo Sevillano: Dentro de la piscina
[28/9/23, 18:55:55] Antonio Murillo Sevillano: Xxx
[28/9/23, 18:56:02] Antonio Murillo Sevillano: Si
[28/9/23, 18:56:36] Antonio Murillo Sevillano: Mucho sudamericano
[28/9/23, 19:42:28] Maga: Alfinal bodeguita??
[28/9/23, 19:45:39] Antonio Murillo Sevillano: Si
[28/9/23, 19:45:43] Antonio Murillo Sevillano: Komo de problema sería
[28/9/23, 19:45:45] Antonio Murillo Sevillano: Si viene Amanda
‎[28/9/23, 19:45:47] Antonio Murillo Sevillano: ‎<adjunto: 00000564-STICKER-2023-09-28-19-45-47.webp>
[28/9/23, 19:45:55] Maga: Nada
[28/9/23, 19:46:02] Maga: Se merece despedirte
[28/9/23, 19:46:15] Maga: Cabronaso no me preguntes eso
[28/9/23, 19:46:26] Maga: Hora??
[28/9/23, 19:46:41] Antonio Murillo Sevillano: 9 aptos
[28/9/23, 19:48:31] Antonio Murillo Sevillano: Aprox
[28/9/23, 19:48:34] Antonio Murillo Sevillano: Tú q hases
[28/9/23, 19:48:35] Maga: Valee
[28/9/23, 19:49:30] Maga: Estoy con pol rida robe y burga en el rio
[28/9/23, 19:52:38] Maga: Me subo a y 15
‎[28/9/23, 19:52:53] Antonio Murillo Sevillano: ‎imagen omitida
[28/9/23, 19:52:57] Antonio Murillo Sevillano: Si quieres ir antes
[28/9/23, 19:53:04] Antonio Murillo Sevillano: Cómo quieras
[28/9/23, 19:53:14] Antonio Murillo Sevillano: Solo me tengo q dar un agua
[28/9/23, 19:55:45] Maga: Antes de las 9 dices?
[28/9/23, 19:55:52] Antonio Murillo Sevillano: Si
‎[28/9/23, 20:05:51] Maga: ‎<adjunto: 00000581-AUDIO-2023-09-28-20-05-51.opus>
‎[28/9/23, 20:05:58] Maga: ‎<adjunto: 00000582-AUDIO-2023-09-28-20-05-58.opus>
[28/9/23, 20:06:01] Antonio Murillo Sevillano: O se escucha
[28/9/23, 20:06:04] Antonio Murillo Sevillano: No se escucha
‎[28/9/23, 20:06:34] Maga: ‎<adjunto: 00000585-AUDIO-2023-09-28-20-06-34.opus>
[28/9/23, 20:06:47] Antonio Murillo Sevillano: Yo con qn
[28/9/23, 20:06:49] Antonio Murillo Sevillano: Si no hay nadie
[28/9/23, 20:07:11] Maga: Ah no se
[28/9/23, 20:07:17] Maga: Como me has dicho de ir antes
[28/9/23, 20:07:29] Maga: Mañana te va a llevar tu vieja?
[28/9/23, 20:07:34] Antonio Murillo Sevillano: Tú y yo
[28/9/23, 20:07:45] Maga: Eso q k es
[28/9/23, 20:07:50] Maga: Venga me doy prisa
[28/9/23, 20:08:12] Maga: A y 35 toy
[28/9/23, 20:08:21] Antonio Murillo Sevillano: Va flama
‎[28/9/23, 20:08:31] Antonio Murillo Sevillano: ‎<adjunto: 00000596-AUDIO-2023-09-28-20-08-31.opus>
‎[28/9/23, 20:09:32] Maga: ‎<adjunto: 00000597-AUDIO-2023-09-28-20-09-32.opus>
‎[28/9/23, 20:09:52] Antonio Murillo Sevillano: ‎<adjunto: 00000598-AUDIO-2023-09-28-20-09-51.opus>
‎[28/9/23, 20:10:17] Maga: ‎<adjunto: 00000599-AUDIO-2023-09-28-20-10-17.opus>
‎[28/9/23, 20:10:20] Antonio Murillo Sevillano: ‎<adjunto: 00000600-PHOTO-2023-09-28-20-10-20.jpg>
[28/9/23, 20:10:29] Antonio Murillo Sevillano: Vaya pinta de follardilla
[28/9/23, 20:10:36] Maga: Que es?
[28/9/23, 20:10:39] Maga: Polska?
[28/9/23, 20:10:40] Antonio Murillo Sevillano: Krakow
[28/9/23, 20:39:20] Maga: Amo??
[28/9/23, 20:40:35] Antonio Murillo Sevillano: Mega
[28/9/23, 20:40:42] Antonio Murillo Sevillano: Enga
[28/9/23, 20:42:12] Maga: Que coche
[28/9/23, 20:42:17] Maga: Miomismo
[28/9/23, 20:42:38] Antonio Murillo Sevillano: Venga
[28/9/23, 20:43:28] Maga: Estoy ya
‎[28/9/23, 20:46:56] Antonio Murillo Sevillano: ‎<adjunto: 00000612-AUDIO-2023-09-28-20-46-56.opus>
[29/9/23, 10:08:39] Antonio Murillo Sevillano: Pregúntale a tu vieja si tiene
[29/9/23, 11:04:17] Antonio Murillo Sevillano: Q no quiero tener q comprarlo allí
‎[29/9/23, 11:13:59] Maga: ‎<adjunto: 00000615-AUDIO-2023-09-29-11-13-59.opus>
‎[29/9/23, 11:14:07] Maga: ‎<adjunto: 00000616-AUDIO-2023-09-29-11-14-07.opus>
[29/9/23, 11:14:48] Antonio Murillo Sevillano: Ya tengo
[29/9/23, 11:14:58] Antonio Murillo Sevillano: Has ido a devolver los paquete ?
‎[29/9/23, 11:44:30] Antonio Murillo Sevillano: ‎<adjunto: 00000619-PHOTO-2023-09-29-11-44-30.jpg>
[29/9/23, 11:44:36] Antonio Murillo Sevillano: Me voy a hacer relojero
[29/9/23, 16:00:50] Maga: A y 45 no?
[29/9/23, 16:08:32] Antonio Murillo Sevillano: Si
[29/9/23, 16:10:26] Maga: Flama
[29/9/23, 16:18:12] Antonio Murillo Sevillano: Cómo no me hagan pagar sobrecargo
[29/9/23, 16:18:18] Antonio Murillo Sevillano: Va a ser la gitanada más épica
[29/9/23, 16:18:19] Antonio Murillo Sevillano: Nunca hecha
[29/9/23, 16:22:56] Maga: Sobre cargo de q
[29/9/23, 16:23:00] Maga: De maleta?
[29/9/23, 16:23:23] Antonio Murillo Sevillano: Si
‎[29/9/23, 16:23:34] Antonio Murillo Sevillano: ‎<adjunto: 00000630-PHOTO-2023-09-29-16-23-34.jpg>
[29/9/23, 16:23:40] Antonio Murillo Sevillano: Cual de las 3 me llevo
[29/9/23, 16:23:52] Maga: No se
[29/9/23, 16:23:56] Maga: La nike la cogia
[29/9/23, 16:24:02] Maga: Y la beige clarita
[29/9/23, 16:24:15] Antonio Murillo Sevillano: Ps voy a tener q llevarlas ahora puestas
[29/9/23, 16:24:25] Antonio Murillo Sevillano: Con el north face
[29/9/23, 16:24:26] Maga: Una en la cintura
[29/9/23, 16:24:30] Maga: Y otra puesta
[29/9/23, 16:24:32] Maga: Boffff
[29/9/23, 16:24:38] Maga: Va a oler a sorro
[29/9/23, 16:24:42] Antonio Murillo Sevillano: Y las botas
[29/9/23, 16:24:44] Antonio Murillo Sevillano: Criando pollos
[29/9/23, 16:24:46] Maga: Madre
[29/9/23, 16:24:48] Maga: De dios
[29/9/23, 16:24:56] Maga: Cuantos grados hacen alli?
[29/9/23, 16:24:56] Antonio Murillo Sevillano: Y calcetines gordos gordos
[29/9/23, 16:25:09] Maga: Diecimuchos?
‎[29/9/23, 16:25:34] Antonio Murillo Sevillano: ‎<adjunto: 00000648-PHOTO-2023-09-29-16-25-34.jpg>
[29/9/23, 16:26:24] Maga: Ostia el mejor dia pa llegar
[29/9/23, 16:26:32] Maga: Vaya calufa padre
[29/9/23, 16:26:37] Antonio Murillo Sevillano: Lluviendo
[29/9/23, 16:29:14] Antonio Murillo Sevillano: La vd q si
[29/9/23, 16:29:27] Antonio Murillo Sevillano: Vaya coñazo de viaje
[29/9/23, 16:29:31] Antonio Murillo Sevillano: A ve si llego ya
[29/9/23, 16:29:50] Maga: Vaya tortura la vd
[29/9/23, 16:29:54] Maga: Llegas mañana no?
[29/9/23, 16:32:07] Maga: Quien va al airport?
[29/9/23, 16:32:57] Antonio Murillo Sevillano: Tú y yo
[29/9/23, 16:33:56] Maga: En el seat?
[29/9/23, 16:34:04] Maga: No no?
[29/9/23, 16:35:07] Antonio Murillo Sevillano: Tú car?
[29/9/23, 16:35:26] Maga: Si eso
[29/9/23, 16:35:33] Antonio Murillo Sevillano: Voy a matar a mi vieja
[29/9/23, 16:35:35] Maga: Como ayer dijiste que querías conducir
[29/9/23, 16:35:43] Antonio Murillo Sevillano: Si pero pensaba q venía mi vieja
[29/9/23, 16:36:29] Maga: A weno
[29/9/23, 16:36:33] Maga: El mio pues
[29/9/23, 16:37:36] Antonio Murillo Sevillano: Ayúdame con las maletas
[29/9/23, 16:37:45] Maga: Ya?
[29/9/23, 16:39:37] Maga: Voy paya
‎[29/9/23, 18:29:15] Antonio Murillo Sevillano: ‎<adjunto: 00000671-AUDIO-2023-09-29-18-29-15.opus>
[29/9/23, 18:31:52] Maga: Ya estas en el plane?
[29/9/23, 18:31:56] Maga: No no?
[29/9/23, 18:32:06] Antonio Murillo Sevillano: Estoy esperando
‎[29/9/23, 18:32:35] Antonio Murillo Sevillano: ‎<adjunto: 00000675-AUDIO-2023-09-29-18-32-35.opus>
‎[29/9/23, 18:32:52] Antonio Murillo Sevillano: ‎<adjunto: 00000676-AUDIO-2023-09-29-18-32-52.opus>
[29/9/23, 22:51:18] Antonio Murillo Sevillano: Tamo en Varsovia
[29/9/23, 22:53:52] Maga: A esquivar puñales
[29/9/23, 22:55:04] Antonio Murillo Sevillano: A buscar tabaco
[29/9/23, 22:55:06] Antonio Murillo Sevillano: Y cerveza
[29/9/23, 22:56:55] Maga: Bofff
[29/9/23, 22:57:03] Maga: Como esta warsaw
[29/9/23, 22:59:45] Antonio Murillo Sevillano: Ps no nos dejan salir aún del avión
[29/9/23, 22:59:49] Antonio Murillo Sevillano: Asiq hasta la polla de avión
[29/9/23, 22:59:57] Antonio Murillo Sevillano: Me ha dado tiempo de leerme hasta un libro que me regaló maría
‎[29/9/23, 23:36:58] Maga: ‎<adjunto: 00000686-AUDIO-2023-09-29-23-36-58.opus>
‎[29/9/23, 23:37:30] Antonio Murillo Sevillano: ‎imagen omitida
‎[29/9/23, 23:37:44] Antonio Murillo Sevillano: ‎<adjunto: 00000688-AUDIO-2023-09-29-23-37-44.opus>
[29/9/23, 23:58:27] Antonio Murillo Sevillano: Illo
[29/9/23, 23:58:32] Antonio Murillo Sevillano: Es pa rayarse
[29/9/23, 23:58:50] Antonio Murillo Sevillano: Q el día q fui a comer con marta Ambrosio a viabilice
[29/9/23, 23:58:58] Antonio Murillo Sevillano: Viapol
[29/9/23, 23:59:03] Antonio Murillo Sevillano: Fuimos a comprar café al jamón
[29/9/23, 23:59:21] Antonio Murillo Sevillano: Vi los condones esos baratos de cojines de 6 a 1 euro
[29/9/23, 23:59:29] Antonio Murillo Sevillano: Los compré y le di a marta Ambrosio la mitad
[29/9/23, 23:59:33] Antonio Murillo Sevillano: Q se iba a Madrid con el parienta
[29/9/23, 23:59:36] Antonio Murillo Sevillano: Pariento
[29/9/23, 23:59:52] Antonio Murillo Sevillano: Y ayer fui yo a estrenar mi mitad
[29/9/23, 23:59:57] Antonio Murillo Sevillano: Y maría se rallo
[30/9/23, 0:00:03] Antonio Murillo Sevillano: Se lo expliqué
[30/9/23, 0:00:15] Antonio Murillo Sevillano: Y lo primero q me dice cuando llego es q sigue rayada x eso
[30/9/23, 0:01:14] Antonio Murillo Sevillano: Y ya se lo he explicado
[30/9/23, 0:01:19] Antonio Murillo Sevillano: dice q no lo ve lógico
[30/9/23, 1:04:47] Maga: Si
[30/9/23, 1:05:32] Maga: Ñoño tu relacion esta construida sobre mas de una decepcion pa ella
[30/9/23, 1:05:38] Maga: Y es normal q se raye
[30/9/23, 1:05:48] Maga: No se q le puedes decir
[30/9/23, 1:05:51] Maga: La vd
[30/9/23, 1:14:43] Antonio Murillo Sevillano: Ya lo he hablado
[30/9/23, 1:14:48] Antonio Murillo Sevillano: Ella quiere q la tranquilice
[30/9/23, 1:15:36] Antonio Murillo Sevillano: He comprado en una gasolinera 24 horas el peor agua que he probado en mi vida
[30/9/23, 1:15:42] Antonio Murillo Sevillano: Sabe cómo agua con gas sin gas
[30/9/23, 1:15:47] Antonio Murillo Sevillano: Salada
[30/9/23, 1:16:51] Maga: No entiendo
[30/9/23, 1:17:07] Maga: Mineralizacion dura🤪🤪
[30/9/23, 1:17:12] Maga: Que hora es alli?
[30/9/23, 1:17:45] Antonio Murillo Sevillano: Q le diga q tengo responsabilidad afectiva y a puede confiar en mi
[30/9/23, 1:17:55] Antonio Murillo Sevillano: Q la tranquilice porque es insegura
[30/9/23, 1:18:02] Maga: No tienes q decirlo mano
[30/9/23, 1:18:03] Maga: No se
[30/9/23, 1:18:11] Antonio Murillo Sevillano: Yo a veces me siento atacado porque sistemáticamente desconfía
[30/9/23, 1:18:12] Maga: En tu posicion no habria q hacerlo
[30/9/23, 1:18:20] Antonio Murillo Sevillano: No se ya lo hemos hablado y hemos quedado bien
[30/9/23, 1:18:27] Maga: Es obvio
[30/9/23, 1:18:28] Antonio Murillo Sevillano: Pero me desgasta un poco
[30/9/23, 1:18:41] Maga: Normal
[30/9/23, 1:18:47] Maga: ??
[30/9/23, 1:18:57] Antonio Murillo Sevillano: Las 11 y 32
[30/9/23, 1:19:04] Antonio Murillo Sevillano: Diga 19
[30/9/23, 1:19:16] Maga: Es la misma
[30/9/23, 1:19:25] Antonio Murillo Sevillano: Ya lo sé paho
[30/9/23, 1:19:29] Antonio Murillo Sevillano: Digo a ve si se raya
[30/9/23, 1:19:40] Maga: Paho
[30/9/23, 1:19:47] Antonio Murillo Sevillano: No hay cambio de hora aunq sea el fin del mundo
[30/9/23, 1:19:50] Maga: Ya te han pedio un euro suelto?
[30/9/23, 1:19:54] Antonio Murillo Sevillano: Si
[30/9/23, 1:19:57] Antonio Murillo Sevillano: Cómo lo sabes
[30/9/23, 1:20:04] Maga: Con esa cara
[30/9/23, 1:23:11] Antonio Murillo Sevillano: Lo follaico q va en flixbus
[30/9/23, 1:23:23] Antonio Murillo Sevillano: Q mi colega tenía q frenar en un semáforo
[30/9/23, 1:23:35] Antonio Murillo Sevillano: Y no le ha dado tiempo a frenar justo en la línea
[30/9/23, 1:24:01] Antonio Murillo Sevillano: se ha frenado más Palante
[30/9/23, 1:24:03] Antonio Murillo Sevillano: Bastante
[30/9/23, 1:24:10] Antonio Murillo Sevillano: Y ha tenido q dar marcha atrás
[30/9/23, 1:52:00] Maga: Realracingsimulator
[30/9/23, 1:52:03] Maga: Me voy a dormi
[30/9/23, 1:52:18] Maga: Espero q estes entero cuando despierte
[30/9/23, 1:52:52] Maga: El novio de lucia alonso
[30/9/23, 1:52:56] Maga: Es del 99
[30/9/23, 1:53:10] Maga: Parece 03
[30/9/23, 5:28:01] Antonio Murillo Sevillano: Ni de coña adivinas cómo es mi habitación o con qn estoy
[30/9/23, 10:31:28] Maga: Hombre a ver
[30/9/23, 10:31:33] Maga: Esta dificil
‎[30/9/23, 12:58:25] Antonio Murillo Sevillano: ‎imagen omitida
[30/9/23, 13:07:48] Maga: ‎Videollamada perdida
‎[30/9/23, 19:12:21] Antonio Murillo Sevillano: ‎imagen omitida
‎[30/9/23, 19:19:40] Maga: ‎<adjunto: 00000757-AUDIO-2023-09-30-19-19-40.opus>
‎[30/9/23, 19:20:15] Antonio Murillo Sevillano: ‎<adjunto: 00000758-AUDIO-2023-09-30-19-20-15.opus>
[30/9/23, 19:27:09] Antonio Murillo Sevillano: Me puedes llamar el primo si quieres
[30/9/23, 19:27:26] Antonio Murillo Sevillano: He comprado tabaco de entubar
‎[30/9/23, 19:36:03] Maga: ‎<adjunto: 00000761-AUDIO-2023-09-30-19-36-03.opus>
[30/9/23, 19:36:14] Antonio Murillo Sevillano: A ve es tabaco
[30/9/23, 19:36:19] Antonio Murillo Sevillano: Si sirve
[30/9/23, 19:36:25] Antonio Murillo Sevillano: Pero está pensado pa entubar
[30/9/23, 19:36:29] Antonio Murillo Sevillano: X eso está tan seco
[30/9/23, 19:36:31] Antonio Murillo Sevillano: No está mal
[30/9/23, 19:36:36] Antonio Murillo Sevillano: Pa de vez en cuando
‎[30/9/23, 20:04:10] Maga: ‎<adjunto: 00000768-AUDIO-2023-09-30-20-04-10.opus>
‎[30/9/23, 20:04:15] Maga: ‎<adjunto: 00000769-AUDIO-2023-09-30-20-04-15.opus>
‎[30/9/23, 20:04:21] Maga: ‎<adjunto: 00000770-AUDIO-2023-09-30-20-04-21.opus>
[30/9/23, 20:24:08] Antonio Murillo Sevillano: Cuando vas
[30/9/23, 20:24:10] Antonio Murillo Sevillano: Hoy ?
[30/9/23, 20:36:40] Maga: Siii
[30/9/23, 20:42:12] Antonio Murillo Sevillano: Porque no has ido a arcos ?
‎[30/9/23, 21:53:35] Antonio Murillo Sevillano: ‎<adjunto: 00000775-VIDEO-2023-09-30-21-53-34.mp4>
[30/9/23, 21:54:10] Maga: Es legal??
[30/9/23, 23:41:22] Antonio Murillo Sevillano: Será cbd
[1/10/23, 0:35:47] Antonio Murillo Sevillano: Acabo de encontrar a rizz legolas
[1/10/23, 0:35:55] Antonio Murillo Sevillano: Polka rizz
[1/10/23, 13:11:46] Maga: Nunca vi el señor de los anillos
[1/10/23, 13:12:58] Maga: Estuvo guapa la noche de ayer
[1/10/23, 13:13:11] Maga: Has salido ya de fiesta?
[1/10/23, 13:15:56] Antonio Murillo Sevillano: no aun no
[1/10/23, 13:16:05] Antonio Murillo Sevillano: q hiciste
[1/10/23, 13:48:18] Antonio Murillo Sevillano: Illo voy a problema con maría por día
[1/10/23, 13:58:12] Maga: Sala cosmos
[1/10/23, 13:58:27] Maga: Con le blank alvaro
[1/10/23, 13:58:41] Maga: Estaba llena d pureta
[1/10/23, 13:58:45] Maga: Puestos
[1/10/23, 13:58:50] Maga: Y de guiris
[1/10/23, 13:58:59] Maga: Pero me lo pase bomba la vd
[1/10/23, 13:59:11] Maga: Pues llevas fuera 3 dias
[1/10/23, 13:59:25] Maga: Yo creo que deberias de hablarlo serio
[1/10/23, 13:59:32] Maga: Xq vas a estar fuera un año
[1/10/23, 13:59:42] Maga: Y te vas a querer matar como esto siga asi
[1/10/23, 17:08:20] Antonio Murillo Sevillano: Si es q cada día es una cosa diferente
[1/10/23, 17:08:25] Antonio Murillo Sevillano: Normal
[2/10/23, 9:19:44] Maga: Que tal la gente alli??
[2/10/23, 9:20:00] Maga: Tienes grupo y estas saliendo? El
‎[2/10/23, 9:25:20] Antonio Murillo Sevillano: ‎imagen omitida
[2/10/23, 9:25:31] Antonio Murillo Sevillano: Mi romate
[2/10/23, 9:25:35] Antonio Murillo Sevillano: No
[2/10/23, 9:25:44] Antonio Murillo Sevillano: Los españoles son un poco pajos
[2/10/23, 9:25:49] Antonio Murillo Sevillano: Y los polacos están locos
[2/10/23, 9:25:56] Antonio Murillo Sevillano: Es una locura la residencia
[2/10/23, 9:26:00] Antonio Murillo Sevillano: La cantidad de gente q hay
[2/10/23, 9:28:40] Maga: Yhulio
[2/10/23, 9:28:40] Antonio Murillo Sevillano: La ve q ahora de amigos stoy struglin
[2/10/23, 9:28:57] Antonio Murillo Sevillano: Julio es lo único q tengo
‎[2/10/23, 9:29:35] Antonio Murillo Sevillano: ‎<adjunto: 00000810-AUDIO-2023-10-02-09-29-35.opus>
[2/10/23, 9:30:33] Maga: Ostias
[2/10/23, 9:30:40] Maga: Vaya puto castigo
[2/10/23, 9:31:01] Maga: Pero no hay chavales normales??
[2/10/23, 9:31:47] Antonio Murillo Sevillano: A ve sólo llevo dos días
[2/10/23, 9:32:26] Antonio Murillo Sevillano: Y esta residencia es mi prisión
[2/10/23, 9:32:30] Antonio Murillo Sevillano: Es q es una ciudad en si misma
‎[2/10/23, 9:34:19] Maga: ‎<adjunto: 00000817-AUDIO-2023-10-02-09-34-19.opus>
‎[2/10/23, 9:34:38] Maga: ‎<adjunto: 00000818-AUDIO-2023-10-02-09-34-38.opus>
‎[2/10/23, 9:37:07] Antonio Murillo Sevillano: ‎<adjunto: 00000819-AUDIO-2023-10-02-09-37-07.opus>
[2/10/23, 9:39:41] Antonio Murillo Sevillano: Ya haré amigos
[2/10/23, 9:39:55] Antonio Murillo Sevillano: La cosa es q la resi está petada de polacos
[2/10/23, 9:39:58] Antonio Murillo Sevillano: ayer me hice amigo de 3
[2/10/23, 9:40:52] Antonio Murillo Sevillano: Si no hago amigos mi objetivo será q Julio empuje y ser el español más fuerte del gimnasio
[2/10/23, 9:41:02] Antonio Murillo Sevillano: Ahora voy a comprar pa hacer la mil prep
[2/10/23, 9:47:39] Maga: Madre mia
[2/10/23, 9:50:33] Maga: Como esta el gym
[2/10/23, 9:52:58] Antonio Murillo Sevillano: Dice Hulio q Chetado
[2/10/23, 11:28:45] Antonio Murillo Sevillano: Se me está yendo de las manos la compra en el lodo
[2/10/23, 11:28:50] Antonio Murillo Sevillano: Iidl
[2/10/23, 11:35:43] Maga: Xq
[2/10/23, 12:09:50] Antonio Murillo Sevillano: Porque soy puro disfrute
[2/10/23, 12:10:23] Maga: Cuanto ha caido
[2/10/23, 12:10:32] Antonio Murillo Sevillano: 36 pavos
[2/10/23, 12:10:36] Antonio Murillo Sevillano: Y he comprado de todo
[2/10/23, 12:10:43] Antonio Murillo Sevillano: Hasta aceite de oliva
[2/10/23, 23:46:23] Maga: Vaya día
[2/10/23, 23:46:28] Maga: He vuelto a muay
[2/10/23, 23:46:40] Antonio Murillo Sevillano: No ibas a esperarte ?
[2/10/23, 23:46:47] Maga: He ido suavito
[2/10/23, 23:47:02] Maga: No me ha dolido
[2/10/23, 23:47:17] Maga: Me he comprado un viaje de equipamiento
‎[2/10/23, 23:47:29] Maga: ‎<adjunto: 00000842-PHOTO-2023-10-02-23-47-29.jpg>
‎[2/10/23, 23:47:33] Maga: ‎<adjunto: 00000843-PHOTO-2023-10-02-23-47-33.jpg>
‎[2/10/23, 23:48:34] Maga: ‎<adjunto: 00000844-PHOTO-2023-10-02-23-48-34.jpg>
[2/10/23, 23:48:39] Maga: Y unas vendas
[2/10/23, 23:48:46] Antonio Murillo Sevillano: De caro la vd
[2/10/23, 23:48:53] Antonio Murillo Sevillano: Eso q es
[2/10/23, 23:49:03] Maga: Mi vieja me ha dicho te pago lo guantes x tu santo
[2/10/23, 23:49:06] Maga: Y digo bof
[2/10/23, 23:49:12] Maga: Cristiano mas k el papa
[2/10/23, 23:49:17] Maga: Un bucal
[2/10/23, 23:49:26] Maga: De colmillos
[2/10/23, 23:49:28] Maga: Tu q te cuenta
[2/10/23, 23:49:41] Maga: Cuando dejas de ser nini
[2/10/23, 23:49:53] Antonio Murillo Sevillano: Grasias Eva si no le iba a tener q deber dinero a la warre 🫡
[2/10/23, 23:50:02] Antonio Murillo Sevillano: Hoy tenía la primera clase
[2/10/23, 23:50:05] Antonio Murillo Sevillano: He ido hasta la facultad
[2/10/23, 23:50:11] Antonio Murillo Sevillano: Llegado 5 min tarde
[2/10/23, 23:50:24] Antonio Murillo Sevillano: Y me he puesto a hablar con el portero gordo pachon pa entrar
[2/10/23, 23:50:31] Maga: Vas a ir a clases?
[2/10/23, 23:50:32] Antonio Murillo Sevillano: Q no sabía inglés
[2/10/23, 23:50:45] Antonio Murillo Sevillano: Y el jipi no tenía ni idea de na
[2/10/23, 23:50:53] Maga: Como se lo has dicho
[2/10/23, 23:50:56] Antonio Murillo Sevillano: al final la clase era online
[2/10/23, 23:51:03] Antonio Murillo Sevillano: El ha sacado el traductor
[2/10/23, 23:51:04] Maga: Vaya makina
[2/10/23, 23:51:06] Antonio Murillo Sevillano: Y he hablado
[2/10/23, 23:51:11] Maga: Mi compadre
[2/10/23, 23:51:13] Antonio Murillo Sevillano: He visto 5 min de clase
[2/10/23, 23:51:15] Antonio Murillo Sevillano: Y he dicho
[2/10/23, 23:51:17] Antonio Murillo Sevillano: Ji
[2/10/23, 23:51:23] Maga: Y de socializar?
[2/10/23, 23:51:26] Maga: Como andamos
[2/10/23, 23:51:28] Antonio Murillo Sevillano: Vemos billy
[2/10/23, 23:51:39] Antonio Murillo Sevillano: Pf cada día me veo más Joan pradells
[2/10/23, 23:51:56] Antonio Murillo Sevillano: Es puto lo de hacer amigos
[2/10/23, 23:52:19] Maga: A ver mas con esos monstruos de rio
[2/10/23, 23:52:29] Maga: Busca españoles en piso
[2/10/23, 23:52:34] Antonio Murillo Sevillano: No hay ninguno q no sea un monstruo de piso
[2/10/23, 23:52:36] Maga: Q les falte coleguita
[2/10/23, 23:52:46] Maga: Tsss
‎[2/10/23, 23:52:48] Antonio Murillo Sevillano: ‎imagen omitida
[2/10/23, 23:53:03] Antonio Murillo Sevillano: Me siento como cuando no me comía un colin
[2/10/23, 23:53:11] Maga: Na es normal
[2/10/23, 23:53:18] Maga: Te has ido solo y han pasao 3 dias
[2/10/23, 23:53:21] Maga: Son unos pajos tb
[2/10/23, 23:53:31] Maga: Yqs si estas mu malamente te vienes en cristmas
[2/10/23, 23:53:34] Maga: Pero vamo
[2/10/23, 23:53:41] Antonio Murillo Sevillano: Va a ser encontrar Wenas amigos más fortuito q las historia de amor q te montas
[2/10/23, 23:53:43] Maga: Q esto te va a durar 2 dias
[2/10/23, 23:53:45] Antonio Murillo Sevillano: No te digo en general
[2/10/23, 23:53:51] Antonio Murillo Sevillano: No puedo
[2/10/23, 23:54:00] Maga: No xq
[2/10/23, 23:54:00] Antonio Murillo Sevillano: Hise un pacto con el diablo
[2/10/23, 23:54:09] Antonio Murillo Sevillano: Mi acuerdo de estudios está endemoniado
[2/10/23, 23:54:19] Maga: ???
[2/10/23, 23:54:22] Maga: K has exo
[2/10/23, 23:54:33] Antonio Murillo Sevillano: Pa empiezan tendría q tocarlo mucho
[2/10/23, 23:54:41] Antonio Murillo Sevillano: Y perdería bastante
[2/10/23, 23:54:46] Antonio Murillo Sevillano: Porque hay asignaturas q son continuas
[2/10/23, 23:54:53] Maga: Shittttt
[2/10/23, 23:55:00] Antonio Murillo Sevillano: Y no puedo hacer un cuatri Aquí y otro alllk
[2/10/23, 23:55:05] Antonio Murillo Sevillano: Así q tendría q hacer de las mías
[2/10/23, 23:55:06] Maga: Ya claro
[2/10/23, 23:55:12] Antonio Murillo Sevillano: Es mi complicado
[2/10/23, 23:55:15] Antonio Murillo Sevillano: Da pereza pensarlo
[2/10/23, 23:55:21] Maga: Y hulio con quien se junta
[2/10/23, 23:55:32] Antonio Murillo Sevillano: Conmifo
[2/10/23, 23:55:37] Maga: Solo?
[2/10/23, 23:55:45] Antonio Murillo Sevillano: Hulio esta sn las mismas
[2/10/23, 23:55:52] Maga: Que si??
[2/10/23, 23:55:57] Maga: No ha salido de fiesta?
[2/10/23, 23:56:01] Antonio Murillo Sevillano: Tambn nos juntamos con uno de Pangea
[2/10/23, 23:56:04] Antonio Murillo Sevillano: Sii
[2/10/23, 23:56:11] Maga: Con quien?
[2/10/23, 23:56:11] Antonio Murillo Sevillano: Conoce a más gente de los españoles
[2/10/23, 23:56:14] Maga: Con los pijo
[2/10/23, 23:56:17] Antonio Murillo Sevillano: Yo he conocido a algunos
[2/10/23, 23:56:23] Antonio Murillo Sevillano: Es q son todos el mismo grupo
[2/10/23, 23:56:24] Maga: Y merece la pena?
[2/10/23, 23:56:31] Antonio Murillo Sevillano: Y no son malos xavales
[2/10/23, 23:56:37] Maga: Weno
[2/10/23, 23:56:39] Antonio Murillo Sevillano: Pero yqse
[2/10/23, 23:56:42] Maga: Queda mas con ellos
[2/10/23, 23:56:44] Antonio Murillo Sevillano: Ahora tocará dejar el tiempo pasar
[2/10/23, 23:56:57] Antonio Murillo Sevillano: Hay discos calibrados de competición en en gimnasio
[2/10/23, 23:57:00] Maga: No esperes q vayas a conectar con to los jipis como con tu grupo de colega
[2/10/23, 23:57:03] Antonio Murillo Sevillano: Y un rack de competición de press banca
[2/10/23, 23:57:05] Antonio Murillo Sevillano: Cosas
[2/10/23, 23:57:11] Maga: Tienws q ser mas laxo
[2/10/23, 23:57:15] Antonio Murillo Sevillano: Familia ❤️‍🩹
[2/10/23, 23:57:17] Maga: Boffffff
[2/10/23, 23:57:23] Maga: Ya
[2/10/23, 23:57:25] Maga: La vd
[2/10/23, 23:57:34] Antonio Murillo Sevillano: Es q hasta los giris son pajunos
[2/10/23, 23:57:46] Maga: No se llevas poco
[2/10/23, 23:57:52] Antonio Murillo Sevillano: Hemos estado en un evento hoy de esn q es como pa gente de Erasmus
[2/10/23, 23:57:55] Antonio Murillo Sevillano: Ya
[2/10/23, 23:57:58] Antonio Murillo Sevillano: X eso digo esto
[2/10/23, 23:58:02] Maga: Alomejor los guays estais escondidos😜
[2/10/23, 23:58:19] Antonio Murillo Sevillano: .
[2/10/23, 23:58:28] Antonio Murillo Sevillano: Si fuese julio tendría ya
[2/10/23, 23:58:33] Maga: Y eran raros?
[2/10/23, 23:58:43] Maga: Tener parienta mas complicao q tener amigos
[2/10/23, 23:58:45] Maga: Pa pensar
[2/10/23, 23:59:18] Maga: Xq no miras gyms de artes marciale
[2/10/23, 23:59:23] Maga: Tipo bjj
[2/10/23, 23:59:27] Antonio Murillo Sevillano: Lo he mirado tambn
[2/10/23, 23:59:30] Maga: Y que
[2/10/23, 23:59:34] Maga: Como esta de precio
[2/10/23, 23:59:34] Antonio Murillo Sevillano: Pero este me sale a 15 euros el mes
[2/10/23, 23:59:39] Maga: Ya coño
[2/10/23, 23:59:47] Maga: Pero lo otro es una inversion
[2/10/23, 23:59:49] Antonio Murillo Sevillano: Y digo de base me va a seguir haciendo falta gym
[2/10/23, 23:59:55] Antonio Murillo Sevillano: Tipo ese está ahí
[2/10/23, 23:59:56] Maga: Ademas los colegas q hagas tambien esta guapo
[3/10/23, 0:00:00] Antonio Murillo Sevillano: Cómo el basic fit
[3/10/23, 0:00:05] Maga: Yaya
[3/10/23, 0:00:08] Maga: Digo un extra
[3/10/23, 0:00:14] Maga: No seran mas de 30 no?
‎[3/10/23, 0:00:29] Antonio Murillo Sevillano: ‎<adjunto: 00000961-AUDIO-2023-10-03-00-00-29.opus>
‎[3/10/23, 0:00:51] Antonio Murillo Sevillano: ‎<adjunto: 00000962-AUDIO-2023-10-03-00-00-50.opus>
‎[3/10/23, 0:01:02] Antonio Murillo Sevillano: ‎<adjunto: 00000963-AUDIO-2023-10-03-00-01-02.opus>
‎[3/10/23, 0:01:50] Antonio Murillo Sevillano: ‎<adjunto: 00000964-AUDIO-2023-10-03-00-01-50.opus>
[3/10/23, 0:02:06] Maga: Xq no le preguntaste
[3/10/23, 0:02:18] Maga: Bof
[3/10/23, 0:02:21] Maga: Seguro
[3/10/23, 0:02:27] Antonio Murillo Sevillano: Porque tenia cara de ruso q te quiere matar
[3/10/23, 0:02:36] Maga: Poca gente acaba siendo asi
‎[3/10/23, 0:02:55] Maga: ‎<adjunto: 00000970-AUDIO-2023-10-03-00-02-55.opus>
[3/10/23, 0:06:15] Maga: Hay wenos kickboxer polacos
‎[3/10/23, 0:06:36] Antonio Murillo Sevillano: ‎<adjunto: 00000972-AUDIO-2023-10-03-00-06-36.opus>
‎[3/10/23, 0:06:57] Antonio Murillo Sevillano: ‎<adjunto: 00000973-AUDIO-2023-10-03-00-06-57.opus>
‎[3/10/23, 0:08:18] Maga: ‎<adjunto: 00000974-AUDIO-2023-10-03-00-08-18.opus>
[3/10/23, 0:09:53] Antonio Murillo Sevillano: Nono ya
‎[3/10/23, 0:10:15] Antonio Murillo Sevillano: ‎<adjunto: 00000976-AUDIO-2023-10-03-00-10-15.opus>
[3/10/23, 0:11:41] Maga: Y cuanto cuesta
‎[3/10/23, 0:11:58] Maga: ‎<adjunto: 00000978-AUDIO-2023-10-03-00-11-58.opus>
‎[3/10/23, 0:20:41] Antonio Murillo Sevillano: ‎<adjunto: 00000979-AUDIO-2023-10-03-00-20-41.opus>
‎[3/10/23, 0:20:58] Antonio Murillo Sevillano: ‎<adjunto: 00000980-AUDIO-2023-10-03-00-20-58.opus>
[3/10/23, 0:21:52] Maga: Corriendo pusi
[3/10/23, 0:22:05] Maga: Asi si q vas a ser el mostro
[3/10/23, 0:22:10] Antonio Murillo Sevillano: La soledad y el tabaco ese hace q fume mas
[3/10/23, 0:22:27] Antonio Murillo Sevillano: Tengo a comprarme camel blue de liar q vale 4,2
[3/10/23, 0:22:32] Antonio Murillo Sevillano: O asin
[3/10/23, 0:22:36] Maga: Como te pongas xetao corras y hagas bjj te doy la que me zumbas
[3/10/23, 0:22:47] Antonio Murillo Sevillano: Si
‎[3/10/23, 0:22:49] Maga: ‎<adjunto: 00000988-AUDIO-2023-10-03-00-22-49.opus>
[3/10/23, 0:22:58] Antonio Murillo Sevillano: Y si mi wela tuviese ruedas sería una harley la
[3/10/23, 0:23:04] Maga: Jajajajajajajajajaja
[3/10/23, 0:23:11] Antonio Murillo Sevillano: No es vigilancia
[3/10/23, 0:23:16] Antonio Murillo Sevillano: Es q cuando bebo fumo
‎[3/10/23, 0:23:41] Maga: ‎<adjunto: 00000993-AUDIO-2023-10-03-00-23-41.opus>
‎[3/10/23, 0:24:35] Antonio Murillo Sevillano: ‎<adjunto: 00000994-AUDIO-2023-10-03-00-24-35.opus>
[3/10/23, 0:25:07] Maga: Pero hacerte un foquin atleta
[3/10/23, 0:25:16] Maga: No solo levantar weights
[3/10/23, 0:25:19] Maga: Corre de noxe
[3/10/23, 0:25:22] Maga: Se un kila
[3/10/23, 0:25:29] Maga: Dejar de se un pussy
[3/10/23, 0:25:31] Antonio Murillo Sevillano: Si fuese julio sería Batman
[3/10/23, 0:25:33] Maga: Rapate
[3/10/23, 0:25:37] Maga: Xq
[3/10/23, 0:25:42] Antonio Murillo Sevillano: Tendría la xurra como un risketo
[3/10/23, 0:25:49] Antonio Murillo Sevillano: Y todo el día training
[3/10/23, 0:26:02] Maga: Jajajajajajaj si
[3/10/23, 0:26:13] Maga: La pixa como un taki
[3/10/23, 0:26:55] Antonio Murillo Sevillano: Si
[3/10/23, 0:26:57] Antonio Murillo Sevillano: Con un bit
[3/10/23, 0:27:42] Antonio Murillo Sevillano: Ahora mismo me parece más fácil comer q hacer amigos
[3/10/23, 0:28:16] Maga: Pero esq son unos pajos
‎[3/10/23, 0:28:42] Maga: ‎<adjunto: 00001011-AUDIO-2023-10-03-00-28-42.opus>
‎[3/10/23, 0:28:54] Maga: ‎<adjunto: 00001012-AUDIO-2023-10-03-00-28-54.opus>
[3/10/23, 0:29:39] Antonio Murillo Sevillano: Nono yaya
[3/10/23, 0:29:50] Antonio Murillo Sevillano: Q es la misma filosofía q pa las tías
[3/10/23, 0:29:54] Antonio Murillo Sevillano: El mar está lleno de peces
[3/10/23, 0:30:02] Maga: No exactamente
[3/10/23, 0:30:10] Maga: Pero si
[3/10/23, 0:30:12] Antonio Murillo Sevillano: Yo creo q es igual
[3/10/23, 0:30:24] Antonio Murillo Sevillano: Al final son dos tipos de relaciones parecidas
[3/10/23, 0:30:45] Antonio Murillo Sevillano: Pa comer hacen falta menos requisitos q para hacer amigo creo
[3/10/23, 0:32:05] Antonio Murillo Sevillano: Mi colega polaco está to ouesto
[3/10/23, 0:32:09] Antonio Murillo Sevillano: Está programando algo
[3/10/23, 0:32:18] Antonio Murillo Sevillano: Una programa o algo
[3/10/23, 0:32:23] Antonio Murillo Sevillano: Q te corrige en el gimnasio
[3/10/23, 0:32:28] Antonio Murillo Sevillano: Metiéndole un vídeo
[3/10/23, 0:32:53] Antonio Murillo Sevillano: Me voy a poner yo en ese mood cómo no aparesca un colegin q beba y fume
[3/10/23, 0:33:00] Antonio Murillo Sevillano: Q Hulio no beber cerveza ni fuma
[3/10/23, 0:49:43] Maga: Vas al gym con el polaco?
‎[3/10/23, 0:49:54] Maga: ‎<adjunto: 00001029-AUDIO-2023-10-03-00-49-54.opus>
[3/10/23, 0:55:07] Antonio Murillo Sevillano: Puesto trabajando
[3/10/23, 0:55:17] Antonio Murillo Sevillano: En el programa ese
[3/10/23, 10:14:53] Maga: Te dan devuelto el dinero?
[3/10/23, 10:18:18] Antonio Murillo Sevillano: Si
[3/10/23, 10:18:20] Antonio Murillo Sevillano: 200
[3/10/23, 10:18:21] Antonio Murillo Sevillano: Je
[3/10/23, 10:18:57] Maga: Bomba
[3/10/23, 10:19:01] Maga: A mi aun no
‎[3/10/23, 14:01:25] Maga: ‎<adjunto: 00001038-VIDEO-2023-10-03-14-01-25.mp4>
[3/10/23, 14:02:47] Antonio Murillo Sevillano: La warre cuando ve un moro
[3/10/23, 14:02:53] Antonio Murillo Sevillano: Sin papeles
[3/10/23, 14:02:59] Antonio Murillo Sevillano: Tarda pal de días
[3/10/23, 14:03:23] Maga: La warre cuando no le compran guxi este mes
[3/10/23, 14:04:14] Maga: La hdp de la niña despues de decirlesi me puede masturbar mas flojito
[3/10/23, 14:04:39] Antonio Murillo Sevillano: Esa ha sido personal
‎[3/10/23, 14:05:02] Maga: ‎<adjunto: 00001045-AUDIO-2023-10-03-14-05-02.opus>
[3/10/23, 14:05:07] Maga: Si
[3/10/23, 14:06:42] Antonio Murillo Sevillano: Toy en clase ahora Dps lo escucho
[3/10/23, 14:06:44] Antonio Murillo Sevillano: Q sueño
[3/10/23, 14:07:06] Maga: Na tmp es relevante
[3/10/23, 14:07:12] Maga: Como es tu clase
[3/10/23, 14:07:51] Antonio Murillo Sevillano: Zzzzz
[3/10/23, 14:08:01] Antonio Murillo Sevillano: El profesor en traje
[3/10/23, 14:08:06] Antonio Murillo Sevillano: Va pa la feria
[3/10/23, 15:00:11] Maga: Bof
[3/10/23, 15:00:18] Maga: Dile q pa juan belmonte 121
[3/10/23, 16:52:32] Antonio Murillo Sevillano: https://vm.tiktok.com/ZGJcAMVTx/
[3/10/23, 16:52:32] Antonio Murillo Sevillano: Vivo en una realidad paralela
[3/10/23, 16:52:32] Antonio Murillo Sevillano: Yo:
[3/10/23, 16:52:32] Antonio Murillo Sevillano: https://vm.tiktok.com/ZGJcAM6Bb/
[3/10/23, 16:57:52] Maga: Jajajajajajajakajajajajajajaja
[3/10/23, 16:57:56] Maga: Si soy
[3/10/23, 16:59:19] Maga: Cual es tu cuenta de amazon prime??
[3/10/23, 16:59:29] Maga: Que me quiero ver ranging bull
‎[3/10/23, 18:59:39] Antonio Murillo Sevillano: ‎<adjunto: 00001064-PHOTO-2023-10-03-18-59-39.jpg>
[3/10/23, 18:59:46] Antonio Murillo Sevillano: Al lado del gym
[3/10/23, 19:00:08] Maga: Apuntateeww
[3/10/23, 19:00:10] Maga: Maricona
[3/10/23, 19:00:20] Maga: A boxeo aunq sea
‎[3/10/23, 19:00:30] Antonio Murillo Sevillano: ‎<adjunto: 00001069-AUDIO-2023-10-03-19-00-30.opus>
‎[3/10/23, 19:01:11] Maga: ‎<adjunto: 00001070-AUDIO-2023-10-03-19-01-11.opus>
[3/10/23, 19:01:34] Maga: Podriamos ser el duo mas letal de sj
[3/10/23, 19:01:39] Maga: Pero tendre q ser el solo
[3/10/23, 19:01:43] Maga: 😞
[3/10/23, 19:18:41] Antonio Murillo Sevillano: Tengo amigos negativos Asiq Alomejor me apunto
[3/10/23, 19:18:51] Antonio Murillo Sevillano: A ve si no me deja ma cuenta en negativo
[3/10/23, 19:35:01] Antonio Murillo Sevillano: He hecho 115 x5 y los jipis se han quedado loca
[3/10/23, 19:35:02] Antonio Murillo Sevillano: Locos
[3/10/23, 19:38:12] Maga: Normal pixa
[3/10/23, 19:38:15] Maga: Quien coño hace esp
‎[3/10/23, 19:40:32] Antonio Murillo Sevillano: ‎imagen omitida
[3/10/23, 19:41:37] Maga: Que jipi ha flipap
[3/10/23, 19:41:47] Antonio Murillo Sevillano: Los españoles amigos de julio
[3/10/23, 19:41:52] Antonio Murillo Sevillano: Y eso q están potentes
[3/10/23, 19:41:53] Maga: Tas tomando creatina?
[3/10/23, 19:42:08] Maga: Mano en fuerza pocos xavales he visto como tu
[3/10/23, 19:42:09] Maga: La vd
[3/10/23, 19:46:05] Antonio Murillo Sevillano: Q a
[3/10/23, 19:46:06] Antonio Murillo Sevillano: Va
[3/10/23, 19:46:29] Antonio Murillo Sevillano: Me he dejado un poco el lumbar en la última repetición la vd
[3/10/23, 21:40:35] Maga: Banca??
[3/10/23, 21:42:22] Antonio Murillo Sevillano: Si
[3/10/23, 21:42:26] Antonio Murillo Sevillano: Vaya locura de sitio
[3/10/23, 21:42:29] Antonio Murillo Sevillano: Me acabo de enterar
[3/10/23, 21:42:33] Antonio Murillo Sevillano: De q en una resi
[3/10/23, 21:42:36] Antonio Murillo Sevillano: Te pelan grafía
[3/10/23, 21:42:39] Antonio Murillo Sevillano: Gratis
[3/10/23, 21:42:44] Antonio Murillo Sevillano: Sin coña
‎[3/10/23, 21:42:48] Maga: ‎<adjunto: 00001098-AUDIO-2023-10-03-21-42-48.opus>
[3/10/23, 21:42:49] Antonio Murillo Sevillano: Q hay una peluquería
[3/10/23, 21:44:32] Maga: Yaya
[3/10/23, 21:44:34] Maga: Que guapo
[3/10/23, 21:44:37] Maga: Y pelan bien?
‎[3/10/23, 21:54:15] Antonio Murillo Sevillano: ‎<adjunto: 00001103-AUDIO-2023-10-03-21-54-14.opus>
[3/10/23, 21:57:24] Maga: Ya
[3/10/23, 21:57:26] Maga: Yqs
[3/10/23, 21:57:28] Maga: Dile poquito
[3/10/23, 21:57:33] Maga: Y si es poco
[3/10/23, 21:57:34] Maga: Dile ma
‎[3/10/23, 21:57:38] Antonio Murillo Sevillano: ‎<adjunto: 00001109-AUDIO-2023-10-03-21-57-38.opus>
‎[3/10/23, 21:58:00] Antonio Murillo Sevillano: ‎<adjunto: 00001110-AUDIO-2023-10-03-21-58-00.opus>
‎[3/10/23, 21:58:32] Antonio Murillo Sevillano: ‎<adjunto: 00001111-AUDIO-2023-10-03-21-58-32.opus>
[3/10/23, 22:01:18] Antonio Murillo Sevillano: Me he puesto gordo la vd
[3/10/23, 22:01:27] Antonio Murillo Sevillano: Me aprieta el pantalón de traje
[3/10/23, 22:01:30] Antonio Murillo Sevillano: Cómo mi muertos
‎[3/10/23, 22:03:49] Antonio Murillo Sevillano: ‎<adjunto: 00001115-PHOTO-2023-10-03-22-03-49.jpg>
‎[3/10/23, 22:50:41] Antonio Murillo Sevillano: ‎<adjunto: 00001116-VIDEO-2023-10-03-22-50-41.mp4>
[3/10/23, 22:53:02] Maga: Boff
[3/10/23, 22:53:06] Maga: Con show
[3/10/23, 22:53:11] Maga: Hoy se sale?
[3/10/23, 22:53:29] Antonio Murillo Sevillano: 105 kg se bestia
[3/10/23, 22:53:36] Antonio Murillo Sevillano: Y esta Lean
[3/10/23, 22:53:41] Antonio Murillo Sevillano: Tampoco loco
[3/10/23, 22:55:43] Maga: El de azul??
[3/10/23, 22:55:54] Maga: Vaya animal
[3/10/23, 22:56:03] Maga: Entrena coño
[3/10/23, 22:57:24] Antonio Murillo Sevillano: Me ha faltado traerme la camiseta de tirantes de putero
[3/10/23, 23:08:12] Maga: Son todos polakos?
[3/10/23, 23:09:12] Antonio Murillo Sevillano: Hasta la médula
[3/10/23, 23:09:34] Antonio Murillo Sevillano: El q sale hablando es mi compañero
[3/10/23, 23:13:31] Maga: El d la barba?
[3/10/23, 23:13:36] Maga: Tiene cara d wena gente
[3/10/23, 23:13:40] Antonio Murillo Sevillano: Si
‎[3/10/23, 23:59:02] Antonio Murillo Sevillano: ‎imagen omitida
[3/10/23, 23:59:08] Antonio Murillo Sevillano: A palo seco
[4/10/23, 0:12:09] Maga: Ese vodka lo conozco
[4/10/23, 0:12:20] Maga: Creo que es el que trajo elena
[4/10/23, 0:18:20] Antonio Murillo Sevillano: No se eh
[4/10/23, 0:18:28] Antonio Murillo Sevillano: Porque este está bien pa beber lo seco
[4/10/23, 0:18:30] Antonio Murillo Sevillano: Pica
[4/10/23, 0:22:41] Maga: Creo q eso es xq el otro tenia mas grados
[4/10/23, 0:22:44] Maga: Ese tiene 26
‎[4/10/23, 0:24:59] Antonio Murillo Sevillano: ‎<adjunto: 00001142-AUDIO-2023-10-04-00-24-59.opus>
[4/10/23, 2:49:03] Antonio Murillo Sevillano: A este ritmo este año me voy a convertir en una bestia polaca del mma
[4/10/23, 4:41:35] Maga: Que tal la noche
[4/10/23, 4:41:40] Maga: Yo pal airport
[4/10/23, 10:59:06] Antonio Murillo Sevillano: Vaya madrugón
[4/10/23, 10:59:19] Antonio Murillo Sevillano: Estas ya o q
[4/10/23, 11:00:38] Maga: Mañanita en milano de empalme casi
[4/10/23, 11:00:56] Maga: Ya me he comio un pistacchio y un cafe latte
[4/10/23, 11:01:50] Antonio Murillo Sevillano: Diablo
[4/10/23, 11:01:54] Antonio Murillo Sevillano: A q hlra el vuelo
[4/10/23, 11:02:07] Maga: 6.30 salia
[4/10/23, 11:02:10] Antonio Murillo Sevillano: Diga
[4/10/23, 11:02:12] Antonio Murillo Sevillano: Tren
[4/10/23, 11:02:14] Antonio Murillo Sevillano: Q estoy dormido
[4/10/23, 11:02:18] Maga: Blablacar
[4/10/23, 11:02:39] Antonio Murillo Sevillano: Cuanto te ha costado
[4/10/23, 11:03:53] Maga: 17
‎[4/10/23, 11:06:36] Maga: ‎<adjunto: 00001159-AUDIO-2023-10-04-11-06-36.opus>
‎[4/10/23, 11:06:59] Maga: ‎<adjunto: 00001160-AUDIO-2023-10-04-11-06-59.opus>
‎[4/10/23, 11:07:32] Maga: ‎<adjunto: 00001161-AUDIO-2023-10-04-11-07-32.opus>
‎[4/10/23, 11:09:26] Maga: ‎<adjunto: 00001162-AUDIO-2023-10-04-11-09-26.opus>
‎[4/10/23, 11:09:32] Maga: ‎<adjunto: 00001163-AUDIO-2023-10-04-11-09-32.opus>
‎[4/10/23, 11:10:46] Maga: ‎<adjunto: 00001164-AUDIO-2023-10-04-11-10-46.opus>
‎[4/10/23, 11:11:42] Maga: ‎<adjunto: 00001165-AUDIO-2023-10-04-11-11-42.opus>
[4/10/23, 11:13:11] Antonio Murillo Sevillano: Se escucha
[4/10/23, 11:13:13] Antonio Murillo Sevillano: Mal mal
[4/10/23, 11:13:28] Antonio Murillo Sevillano: Los cascos la vd cómo no le hables al micro son ruina
[4/10/23, 11:16:17] Maga: Las niñas wapas d sj se las ha quedado milan
[4/10/23, 11:16:56] Antonio Murillo Sevillano: Desde q tengo el detector de perris apagado apenas veo
[4/10/23, 11:22:54] Maga: A ver si me responde la del blabla
[4/10/23, 11:23:01] Maga: Que no me ha confirmao
[4/10/23, 11:23:09] Antonio Murillo Sevillano: No te ha confirmado cómo
[4/10/23, 11:23:16] Antonio Murillo Sevillano: estas ya en el tríp
[4/10/23, 11:23:18] Antonio Murillo Sevillano: O aun no
‎[4/10/23, 11:23:43] Maga: ‎<adjunto: 00001176-AUDIO-2023-10-04-11-23-43.opus>
‎[4/10/23, 11:23:48] Maga: ‎<adjunto: 00001177-AUDIO-2023-10-04-11-23-48.opus>
[4/10/23, 11:23:57] Antonio Murillo Sevillano: Quítate los cascos
[4/10/23, 11:24:11] Antonio Murillo Sevillano: A
[4/10/23, 11:24:14] Maga: Que yo he reservado
[4/10/23, 11:24:15] Antonio Murillo Sevillano: Q estás en lo típico
[4/10/23, 11:24:18] Antonio Murillo Sevillano: De de
[4/10/23, 11:24:19] Maga: Si me coge
[4/10/23, 11:24:21] Maga: Po si
[4/10/23, 11:24:25] Antonio Murillo Sevillano: Esperar q te acepte
[4/10/23, 11:25:00] Antonio Murillo Sevillano: Miraste flixbus ?
[4/10/23, 11:34:35] Maga: So
[4/10/23, 11:34:35] Maga: Si
[4/10/23, 11:34:43] Maga: Caruno
‎[4/10/23, 13:01:17] Maga: ‎<adjunto: 00001190-AUDIO-2023-10-04-13-01-17.opus>
[4/10/23, 13:01:54] Antonio Murillo Sevillano: Q has comido solo ?
‎[4/10/23, 13:01:57] Maga: ‎<adjunto: 00001192-AUDIO-2023-10-04-13-01-57.opus>
[4/10/23, 13:02:03] Antonio Murillo Sevillano: Tenías q haber ido al miscusi
[4/10/23, 13:02:06] Antonio Murillo Sevillano: Q es barato
‎[4/10/23, 13:02:13] Maga: ‎<adjunto: 00001195-AUDIO-2023-10-04-13-02-13.opus>
[4/10/23, 13:02:14] Antonio Murillo Sevillano: Y esta Weno
[4/10/23, 13:02:22] Maga: Keseso
[4/10/23, 13:02:22] Antonio Murillo Sevillano: Y te ponen jarra de asa
[4/10/23, 13:02:31] Antonio Murillo Sevillano: Un Sitio de pasta
‎[4/10/23, 13:02:50] Maga: ‎<adjunto: 00001200-AUDIO-2023-10-04-13-02-50.opus>
[4/10/23, 13:03:05] Antonio Murillo Sevillano: Mi colega de caro
[4/10/23, 13:03:06] Antonio Murillo Sevillano: Caro
[4/10/23, 13:03:23] Antonio Murillo Sevillano: Yo estoy haciendo Carne mechada
[4/10/23, 13:03:24] Antonio Murillo Sevillano: A ve q sale
‎[4/10/23, 13:04:11] Maga: ‎<adjunto: 00001205-AUDIO-2023-10-04-13-04-11.opus>
‎[4/10/23, 13:04:24] Maga: ‎<adjunto: 00001206-AUDIO-2023-10-04-13-04-24.opus>
‎[4/10/23, 13:05:39] Maga: ‎<adjunto: 00001207-AUDIO-2023-10-04-13-05-39.opus>
‎[4/10/23, 13:06:17] Antonio Murillo Sevillano: ‎<adjunto: 00001208-AUDIO-2023-10-04-13-06-17.opus>
‎[4/10/23, 13:06:32] Antonio Murillo Sevillano: ‎imagen omitida
[4/10/23, 13:08:52] Maga: Bof
[4/10/23, 13:09:02] Maga: Que es cinta o cabeza de lomo?
‎[4/10/23, 13:09:54] Maga: ‎<adjunto: 00001212-AUDIO-2023-10-04-13-09-54.opus>
[4/10/23, 13:11:02] Maga: Como te quedes mirando una te pierdes tres
‎[4/10/23, 13:11:50] Maga: ‎<adjunto: 00001214-AUDIO-2023-10-04-13-11-50.opus>
‎[4/10/23, 13:11:59] Maga: ‎<adjunto: 00001215-AUDIO-2023-10-04-13-11-59.opus>
[4/10/23, 13:13:48] Antonio Murillo Sevillano: Que ricas están
[4/10/23, 13:13:54] Antonio Murillo Sevillano: Pero que tontas son
[4/10/23, 13:20:12] Maga: He descubierto el peor arquetipo de mujer
[4/10/23, 13:20:19] Maga: Mexicana con dinero
[4/10/23, 13:23:58] Antonio Murillo Sevillano: Sudamericana buscando sugar daddy es peor
[4/10/23, 13:24:08] Maga: Es lo mismo casi
[4/10/23, 13:24:24] Maga: Habia dos hablando de que querian un Loi boiton
[4/10/23, 13:24:38] Maga: El dinero es de un hombre
[4/10/23, 13:24:47] Antonio Murillo Sevillano: A
[4/10/23, 13:24:50] Antonio Murillo Sevillano: Entonces ella no tiene na
[4/10/23, 13:24:57] Maga: Mano el papa
[4/10/23, 13:25:07] Maga: Es el sugar daddy de las ricas
‎[4/10/23, 14:51:52] Maga: ‎<adjunto: 00001228-AUDIO-2023-10-04-14-51-52.opus>
[4/10/23, 15:07:21] Antonio Murillo Sevillano: Ya
[4/10/23, 15:07:36] Antonio Murillo Sevillano: Me pasó el dia que vine
[4/10/23, 15:07:43] Antonio Murillo Sevillano: Q parecía interminable el dia
[4/10/23, 15:07:51] Maga: Si tio
[4/10/23, 15:07:55] Maga: Estoy hasta la polla
[4/10/23, 15:08:01] Maga: Solo quiero ducharme y dormir
[4/10/23, 15:08:13] Antonio Murillo Sevillano: Te va a llevar de rave la italiana 😜
[4/10/23, 15:08:37] Maga: Pues me voy a tener que poner la tocha como la de voldemort
‎[4/10/23, 16:21:46] Antonio Murillo Sevillano: ‎imagen omitida
[4/10/23, 16:22:16] Maga: Ya solo me quedan 19000 pavos
[4/10/23, 16:22:26] Maga: Soy miguelito pelotas de acero
[4/10/23, 16:22:43] Maga: Me estoy durmiendo en un blablacar a 140 italiano
[4/10/23, 16:22:53] Maga: Puede ser q me mate y no me de ni cuenta
[4/10/23, 16:23:03] Antonio Murillo Sevillano: Dale caña
[4/10/23, 16:23:05] Antonio Murillo Sevillano: Cuanto tarda
[4/10/23, 16:23:07] Maga: Me despierte bajo custodia de san pedro
[4/10/23, 16:23:15] Maga: 3 h pone en distancia
[4/10/23, 16:23:24] Maga: Supongo q 2h y 45
[4/10/23, 16:23:29] Maga: Al ritmito weno
[4/10/23, 16:24:08] Maga: Casi me voy en uno q tenia un serie 5
[4/10/23, 16:24:16] Maga: Ese hubiese sio la experiencia wena
[4/10/23, 16:24:29] Maga: Pegao al asiento de la nave
[4/10/23, 19:47:11] Antonio Murillo Sevillano: como vas
[4/10/23, 19:47:23] Antonio Murillo Sevillano: vamos supongo q ya habras llegado justo
[4/10/23, 20:12:37] Maga: Llegue a las 18.40
[4/10/23, 20:12:38] Maga: O asi
[4/10/23, 20:12:50] Antonio Murillo Sevillano: La nave
[4/10/23, 20:12:56] Antonio Murillo Sevillano: Bien o q
[4/10/23, 21:45:18] Maga: Si tio
[4/10/23, 21:45:22] Maga: Tiene una 125
[4/10/23, 21:45:27] Maga: Y la conduce como pedrosa
[4/10/23, 21:45:37] Maga: He pasao miedo
[4/10/23, 21:46:15] Antonio Murillo Sevillano: Bof
[4/10/23, 21:46:18] Antonio Murillo Sevillano: Eso gusta
[4/10/23, 21:46:40] Antonio Murillo Sevillano: Yo he ligado en el gym
[4/10/23, 21:46:46] Antonio Murillo Sevillano: Un día q no vengo con julio
[4/10/23, 21:46:53] Antonio Murillo Sevillano: Y se me pegan
[4/10/23, 21:47:02] Antonio Murillo Sevillano: Menos mal q me prepare un fondo de pantalla de la parien
[4/10/23, 21:48:39] Maga: Bof
[4/10/23, 21:48:41] Maga: Casap
[4/10/23, 21:48:44] Maga: Con quien
[5/10/23, 0:30:13] Antonio Murillo Sevillano: no se
[5/10/23, 0:30:15] Antonio Murillo Sevillano: una random
[5/10/23, 0:30:25] Antonio Murillo Sevillano: q me ha dicho q si estaba en su resi
[5/10/23, 0:30:33] Antonio Murillo Sevillano: y q estaba muy oscuroq  si la podia acompañar
[5/10/23, 0:30:43] Antonio Murillo Sevillano: al final si q estaba muy oscuro y no queria na creo
[5/10/23, 0:40:08] Antonio Murillo Sevillano: [0:26, 5/10/2023] María: es porque mucho mucho dinero no sobra
[0:26, 5/10/2023] Antonio Murillo Sevillano: yoqse la vd
[0:26, 5/10/2023] María: o porque eres más avaricioso que don cangrejo
[0:26, 5/10/2023] Antonio Murillo Sevillano: no se si es el negocio mas lucido
[0:26, 5/10/2023] Antonio Murillo Sevillano: tambien te digo
[0:26, 5/10/2023] Antonio Murillo Sevillano: pa cosas dificiles de enteder
[0:27, 5/10/2023] Antonio Murillo Sevillano: tu gestion de historias en ig
[0:27, 5/10/2023] Antonio Murillo Sevillano: literalmente tienes 4 rangos de personas pa enseñarles cosas
[5/10/23, 0:41:03] Antonio Murillo Sevillano: esta tan feo eso?
[5/10/23, 0:41:18] Antonio Murillo Sevillano: estabamos hablando de otra cosa normal y de coña le he dicho eso
[5/10/23, 0:43:13] Antonio Murillo Sevillano: pq tenia curiosidad de q diferencia hay entre lo q sube
[5/10/23, 0:43:22] Antonio Murillo Sevillano: pq tiene 2 cuentas y usa mejores amigos en ambas
[5/10/23, 0:43:37] Antonio Murillo Sevillano: creo q lo q me falla es q a veces hablo con ella como si fueses tu
[5/10/23, 0:43:43] Antonio Murillo Sevillano: y dps me doy cuenta de q no eres tu
[5/10/23, 0:58:23] Antonio Murillo Sevillano: illo es q no puedo mas
[5/10/23, 0:58:32] Antonio Murillo Sevillano: parece q lo hago todo mal
[5/10/23, 0:59:07] Antonio Murillo Sevillano: me ha llamado por video llamada y la vd q no lo he arreglado pero pq estaba raro y tenso y nervioso
[5/10/23, 2:07:02] Antonio Murillo Sevillano: es q aun q al final lo arreglemos y acabemos bien hay una parte de mi q no sale bien de la pelea
[5/10/23, 10:28:36] Maga: No entiendo
[5/10/23, 10:28:55] Maga: De que estabais hablando
[5/10/23, 10:29:54] Maga: Ya es complicao
[5/10/23, 10:30:14] Maga: Sigo sin entender
[5/10/23, 10:31:50] Antonio Murillo Sevillano: No a ve de na importante
[5/10/23, 10:31:52] Maga: Esq no entiendo el punto de decir eso ni de la discusion
[5/10/23, 10:31:58] Antonio Murillo Sevillano: Na estaba cambiando de tema
[5/10/23, 10:32:05] Antonio Murillo Sevillano: Porque Justo me acababa de meter en ig
[5/10/23, 10:34:02] Antonio Murillo Sevillano: Tú a tal ayer
[5/10/23, 11:43:16] Maga: Pero que vistee
[5/10/23, 11:45:45] Antonio Murillo Sevillano: Na
[5/10/23, 11:45:50] Antonio Murillo Sevillano: Q tenía curiosidad
[5/10/23, 11:46:01] Antonio Murillo Sevillano: Porque tiene 4 categorías a las q enseñar gente
[5/10/23, 11:46:17] Antonio Murillo Sevillano: Y digo como diferencia q sube a cada
[5/10/23, 11:46:19] Antonio Murillo Sevillano: Una tontería
[5/10/23, 12:05:12] Maga: Ya
[5/10/23, 12:05:16] Maga: Bieen
[5/10/23, 12:05:21] Maga: Conoci a sus amigas
[5/10/23, 12:05:25] Maga: Tomamos aperitivo
[5/10/23, 12:05:51] Maga: Nos fuimos a su casa como marc en la ultima curva de el circuito de xerez
[5/10/23, 12:06:17] Maga: Y vino una amiga suya x la noxe a su casa
[5/10/23, 12:06:35] Maga: Y cuando se fue me dormi de una
[5/10/23, 12:06:44] Maga: Son to buena gente sus amigas la vd
[5/10/23, 13:23:08] Antonio Murillo Sevillano: homnbre no van a ser mala
[5/10/23, 13:57:29] Antonio Murillo Sevillano: Quieres 25 pavos
[5/10/23, 13:57:34] Antonio Murillo Sevillano: Dile q de la deje
[5/10/23, 14:11:01] Maga: Si
[5/10/23, 14:34:40] Antonio Murillo Sevillano: Únete a los más de 30 millones de usuarios a los que nos encanta Revolut. Regístrate con este enlace: https://revolut.com/referral/?referral-code=antonig3vq!OCT1-23-AR
[5/10/23, 16:21:59] Antonio Murillo Sevillano: Hazlo
[5/10/23, 16:37:49] Antonio Murillo Sevillano: Te mande la foto de Orosa calvo ?
[5/10/23, 17:10:15] Maga: Que?
[5/10/23, 17:10:18] Maga: JAJAJAJAAJ
[5/10/23, 17:10:21] Maga: LA HA PUESTO??
[5/10/23, 17:10:25] Antonio Murillo Sevillano: No
[5/10/23, 17:10:26] Maga: Pasatela hombre
[5/10/23, 17:10:30] Maga: Shit
[5/10/23, 17:10:31] Antonio Murillo Sevillano: Se rapo a secas
[5/10/23, 17:10:40] Maga: Vaya gei
[5/10/23, 17:10:51] Maga: Va a ser el niño malo de toy story
‎[5/10/23, 17:11:01] Antonio Murillo Sevillano: ‎<adjunto: 00001325-PHOTO-2023-10-05-17-11-01.jpg>
[5/10/23, 17:28:02] Maga: jajajajajajajaja
[5/10/23, 17:28:05] Maga: Acerte
[5/10/23, 17:28:14] Maga: Buena linea del pelo tiene el hdp
[5/10/23, 21:41:48] Antonio Murillo Sevillano: Si
[5/10/23, 21:41:59] Antonio Murillo Sevillano: De playmobil
‎[5/10/23, 21:42:05] Antonio Murillo Sevillano: ‎Video omitido
[5/10/23, 23:00:32] Antonio Murillo Sevillano: Me siento como un caramelito de licor aquí
[5/10/23, 23:08:33] Maga: Bof lamuñequita de hulio
[5/10/23, 23:18:32] Antonio Murillo Sevillano: Julio es un alfiler
[5/10/23, 23:18:37] Antonio Murillo Sevillano: Un cisne
[5/10/23, 23:18:41] Antonio Murillo Sevillano: Cómo se mueve
[5/10/23, 23:37:36] Antonio Murillo Sevillano: Este es el ejemplo perfecto de el Sitio perfecto
[5/10/23, 23:37:47] Antonio Murillo Sevillano: Pero el sitio da igual y lo q importa es la compañía
[6/10/23, 1:54:05] Antonio Murillo Sevillano: Es imposible coachear a julio
[6/10/23, 1:54:07] Antonio Murillo Sevillano: Es gey
[6/10/23, 1:54:09] Antonio Murillo Sevillano: Y tonto
[6/10/23, 2:28:27] Antonio Murillo Sevillano: Alérgico a las tetas
‎[6/10/23, 2:29:55] Antonio Murillo Sevillano: ‎<adjunto: 00001343-PHOTO-2023-10-06-02-29-55.jpg>
[6/10/23, 9:58:46] Maga: Jajajajajajaj
[6/10/23, 9:58:49] Maga: Que ha hecho
[6/10/23, 9:58:57] Maga: Tan malo
[6/10/23, 9:59:08] Maga: Sad
[6/10/23, 16:54:31] Antonio Murillo Sevillano: yo nada
[6/10/23, 16:54:40] Antonio Murillo Sevillano: pero q hulio era alergico a las tetas
[6/10/23, 16:54:43] Antonio Murillo Sevillano: a las mujeres
[6/10/23, 21:49:06] Antonio Murillo Sevillano: Cómo va el trío
[6/10/23, 21:49:08] Antonio Murillo Sevillano: Trip
[6/10/23, 23:36:18] Maga: Muy guapo
[6/10/23, 23:36:20] Maga: La vd
[6/10/23, 23:36:25] Maga: La gente es muy buena
[6/10/23, 23:36:40] Maga: Se me esta quedando un español con musiquilla italiana
[6/10/23, 23:36:51] Maga: No podria vivir fuera de españa
[6/10/23, 23:36:59] Maga: Seria el tipico gilipollas
[6/10/23, 23:37:17] Antonio Murillo Sevillano: What too much pusy do to me
[6/10/23, 23:37:20] Antonio Murillo Sevillano: Mf
[6/10/23, 23:37:30] Antonio Murillo Sevillano: A mi me acaban de clavar 35 de multa de Tran
[6/10/23, 23:41:03] Maga: Queeeee hablaa
[6/10/23, 23:41:14] Antonio Murillo Sevillano: X confiarme
[6/10/23, 23:41:16] Maga: Ya te han metido la polla por hacef la cuca?
[6/10/23, 23:41:19] Antonio Murillo Sevillano: Culpa del Hulio
[6/10/23, 23:41:25] Antonio Murillo Sevillano: Yo suelo ir sicopata
[7/10/23, 9:27:46] Maga: Porque
[7/10/23, 9:27:50] Maga: Que hiso
[7/10/23, 9:41:53] Antonio Murillo Sevillano: Na ir como si estuviese en el sofá de su casa
[7/10/23, 9:44:16] Maga: Habéis hecho colegiitas?
[7/10/23, 10:38:46] Antonio Murillo Sevillano: si
[7/10/23, 10:38:48] Antonio Murillo Sevillano: de unas italianas
[7/10/23, 10:38:52] Antonio Murillo Sevillano: weno no solo italianas
[7/10/23, 13:27:13] Maga: Quien mas
[7/10/23, 13:27:22] Maga: El victor ha vuelto con marta naranjo?
[7/10/23, 14:33:09] Antonio Murillo Sevillano: Parienta ?
[7/10/23, 14:33:10] Antonio Murillo Sevillano: No
[7/10/23, 15:01:52] Maga: No no
[7/10/23, 15:01:59] Maga: Pero roneito
[7/10/23, 15:34:20] Antonio Murillo Sevillano: Si
[7/10/23, 15:34:28] Antonio Murillo Sevillano: Víctor veleta martin
‎[7/10/23, 16:18:23] Antonio Murillo Sevillano: ‎imagen omitida
[7/10/23, 17:15:20] Maga: Mil prep?
[7/10/23, 17:15:28] Antonio Murillo Sevillano: si
[7/10/23, 17:15:30] Antonio Murillo Sevillano: a ve q me dura
[7/10/23, 17:15:34] Antonio Murillo Sevillano: kilo y medio de carne
[7/10/23, 17:16:02] Maga: Que has cocinado
[7/10/23, 17:16:09] Antonio Murillo Sevillano: boloñesa
[7/10/23, 17:16:15] Antonio Murillo Sevillano: y tres carnes diferentes
[7/10/23, 17:16:21] Antonio Murillo Sevillano: pollo pavo y ternera
[7/10/23, 17:16:28] Antonio Murillo Sevillano: con arroz integral
[7/10/23, 17:16:32] Antonio Murillo Sevillano: aqui se hace to facil
[7/10/23, 17:16:35] Antonio Murillo Sevillano: vienen como en bolsitas
[7/10/23, 17:16:38] Antonio Murillo Sevillano: y las metes en el agua
[7/10/23, 21:52:44] Antonio Murillo Sevillano: Polonia es una simulación
[8/10/23, 3:03:30] Antonio Murillo Sevillano: Illlo
[8/10/23, 3:03:33] Antonio Murillo Sevillano: Me ha ganado
[8/10/23, 3:03:49] Antonio Murillo Sevillano: Mi. Cónpaq
[8/10/23, 3:04:05] Antonio Murillo Sevillano: Mañana estoy en Judíos
‎[8/10/23, 3:09:31] Maga: ‎<adjunto: 00001400-AUDIO-2023-10-08-03-09-31.opus>
‎[8/10/23, 3:09:40] Maga: ‎<adjunto: 00001401-AUDIO-2023-10-08-03-09-40.opus>
‎[8/10/23, 3:18:52] Antonio Murillo Sevillano: ‎<adjunto: 00001402-AUDIO-2023-10-08-03-18-52.opus>
‎[8/10/23, 3:19:09] Antonio Murillo Sevillano: ‎<adjunto: 00001403-AUDIO-2023-10-08-03-19-09.opus>
[8/10/23, 3:23:01] Antonio Murillo Sevillano: Subrrausgay
‎[8/10/23, 3:31:47] Antonio Murillo Sevillano: ‎<adjunto: 00001405-AUDIO-2023-10-08-03-31-47.opus>
[8/10/23, 4:09:17] Maga: ‎Videollamada perdida
[8/10/23, 8:56:35] Maga: Son los mejores audios que has mandado
[8/10/23, 8:56:47] Maga: Posiblemente
[8/10/23, 12:59:05] Antonio Murillo Sevillano: Vaya paranoia
[8/10/23, 12:59:12] Antonio Murillo Sevillano: Tú imagínate
[8/10/23, 12:59:28] Antonio Murillo Sevillano: Con la cantidad de chupitos q llevaba
[8/10/23, 12:59:34] Antonio Murillo Sevillano: Sin cenar porque venía del gym
[8/10/23, 13:11:50] Antonio Murillo Sevillano: Acabo de ver la llamada
[8/10/23, 13:11:55] Antonio Murillo Sevillano: A las 4 estaba en el sobre
[8/10/23, 14:19:59] Antonio Murillo Sevillano: No se porque
‎[8/10/23, 14:27:04] Maga: ‎<adjunto: 00001416-AUDIO-2023-10-08-14-27-04.opus>
[8/10/23, 16:14:21] Antonio Murillo Sevillano: Como te tratan
[8/10/23, 17:13:31] Maga: De puta madre la vd
[8/10/23, 17:28:26] Antonio Murillo Sevillano: Me duele el hombro de pegarme con el jipi
‎[8/10/23, 18:04:21] Maga: ‎<adjunto: 00001420-AUDIO-2023-10-08-18-04-21.opus>
‎[8/10/23, 18:32:15] Antonio Murillo Sevillano: ‎<adjunto: 00001421-AUDIO-2023-10-08-18-32-15.opus>
[8/10/23, 18:39:49] Maga: Menos mal
[8/10/23, 18:39:57] Maga: Que me ha llegado el dinero del vaper
[8/10/23, 18:40:05] Maga: Porque estoy viviendo como don dinero
[8/10/23, 18:40:07] Maga: Comiendo ostras
[8/10/23, 18:40:53] Antonio Murillo Sevillano: Mi colega el q decía q ahorraba
‎[8/10/23, 18:46:56] Maga: ‎<adjunto: 00001427-AUDIO-2023-10-08-18-46-56.opus>
[8/10/23, 18:48:08] Antonio Murillo Sevillano: Ni idea
[8/10/23, 18:48:10] Antonio Murillo Sevillano: Algo sabía
[8/10/23, 18:48:15] Antonio Murillo Sevillano: No se si wrestling
[8/10/23, 18:48:17] Antonio Murillo Sevillano: O q cárabo
[8/10/23, 18:48:19] Antonio Murillo Sevillano: Carajo
‎[8/10/23, 18:55:20] Maga: ‎<adjunto: 00001433-AUDIO-2023-10-08-18-55-20.opus>
‎[8/10/23, 18:55:30] Maga: ‎<adjunto: 00001434-AUDIO-2023-10-08-18-55-30.opus>
[8/10/23, 18:55:59] Antonio Murillo Sevillano: Bueno eso y que venía de potar y beberme vodka a palo seco
[8/10/23, 19:05:28] Maga: Papaste???
[8/10/23, 19:06:32] Antonio Murillo Sevillano: Manin
[8/10/23, 19:06:38] Antonio Murillo Sevillano: Tú sabes q es mi mecanismo ancestral
‎[8/10/23, 19:07:18] Maga: ‎<adjunto: 00001439-AUDIO-2023-10-08-19-07-18.opus>
[8/10/23, 19:10:24] Antonio Murillo Sevillano: Fíjate cómo iba
[8/10/23, 19:10:30] Antonio Murillo Sevillano: Vomite vodka solo
[8/10/23, 19:10:35] Antonio Murillo Sevillano: Y na y menos
‎[8/10/23, 19:12:02] Maga: ‎<adjunto: 00001443-AUDIO-2023-10-08-19-12-02.opus>
‎[8/10/23, 19:12:07] Maga: ‎<adjunto: 00001444-AUDIO-2023-10-08-19-12-07.opus>
[8/10/23, 19:12:28] Antonio Murillo Sevillano: Es igual creo
[8/10/23, 19:12:33] Antonio Murillo Sevillano: 40 grados
‎[8/10/23, 19:12:50] Maga: ‎<adjunto: 00001447-AUDIO-2023-10-08-19-12-50.opus>
[8/10/23, 19:13:04] Antonio Murillo Sevillano: No se
[8/10/23, 19:13:07] Antonio Murillo Sevillano: Ya estoy hecho
[8/10/23, 20:48:14] Antonio Murillo Sevillano: El día de hoy tambn ha sido paranoia
[8/10/23, 20:48:17] Antonio Murillo Sevillano: Ya te lo contaré
[9/10/23, 9:32:43] Maga: Y eso
[9/10/23, 9:33:06] Maga: Concertamos video llamada para mañana a la noche?
[9/10/23, 10:33:00] Antonio Murillo Sevillano: Enga
[9/10/23, 10:33:06] Antonio Murillo Sevillano: Una semana y ya me he puesto malo
[9/10/23, 10:38:59] Antonio Murillo Sevillano: Tiene q ver con maría
[9/10/23, 10:49:21] Maga: Va mal la cosa??
[9/10/23, 11:07:16] Antonio Murillo Sevillano: La cosa es q María es muy desconfiada e insegura
[9/10/23, 11:07:32] Antonio Murillo Sevillano: Por cosas que le han pasado en otras relaciones
[9/10/23, 11:07:58] Antonio Murillo Sevillano: Y ayer creía 100% q la había engañado
[9/10/23, 11:08:17] Antonio Murillo Sevillano: Porque estuve 3 horas por la noche cuando estaba borrachísimo q no cogí el móvil
[9/10/23, 11:13:36] Maga: Mano
[9/10/23, 11:13:40] Maga: Con todo el respeto
[9/10/23, 11:13:43] Maga: Eso no es normal
[9/10/23, 11:13:48] Maga: Para nada
[9/10/23, 11:13:55] Maga: Pase lo q le haya pasado
[9/10/23, 11:14:01] Maga: Tienes que establecer tus limites
[9/10/23, 11:14:09] Maga: Y no puedes estar todo el rato pegado al movil
‎[9/10/23, 11:15:50] Antonio Murillo Sevillano: ‎<adjunto: 00001469-AUDIO-2023-10-09-11-15-50.opus>
[9/10/23, 11:16:13] Antonio Murillo Sevillano: Ya
[9/10/23, 11:16:16] Antonio Murillo Sevillano: No se
[9/10/23, 11:16:42] Antonio Murillo Sevillano: Me desgasta muchísimo pelearme
‎[9/10/23, 11:25:32] Maga: ‎<adjunto: 00001473-AUDIO-2023-10-09-11-25-32.opus>
‎[9/10/23, 11:26:06] Maga: ‎<adjunto: 00001474-AUDIO-2023-10-09-11-26-06.opus>
[9/10/23, 12:40:59] Maga: Te llegan mis msj?
[9/10/23, 12:41:07] Antonio Murillo Sevillano: si
[9/10/23, 12:41:09] Antonio Murillo Sevillano: es q estoy en clase
[9/10/23, 12:41:13] Antonio Murillo Sevillano: vaya ganas de potarla
[9/10/23, 12:41:27] Antonio Murillo Sevillano: una semana he aguantado vivo
[9/10/23, 12:47:22] Maga: No no esq me iban de culo no xq no m respondas
[9/10/23, 15:18:48] Antonio Murillo Sevillano: Vaya dolor de cuello tengo
[9/10/23, 15:19:04] Antonio Murillo Sevillano: No me vuelvo a matar con un polaco
[9/10/23, 15:19:30] Antonio Murillo Sevillano: Lo de maría es complicado
[9/10/23, 15:19:37] Antonio Murillo Sevillano: Fue algo de todo el día de ayer
[9/10/23, 15:19:51] Antonio Murillo Sevillano: Creo q no tiene solución x mi parte
[9/10/23, 15:19:54] Maga: Mano es un comportamiento q ya hemos visto mas veces
[9/10/23, 15:19:57] Maga: No
[9/10/23, 15:20:14] Maga: Pero esq si no tiene solucion por la suya es un grave problema
[9/10/23, 15:20:26] Antonio Murillo Sevillano: Es q no se si ella lo ve como problema
[9/10/23, 15:20:33] Antonio Murillo Sevillano: Aunq yo creo q se lo he dicho
[9/10/23, 15:20:40] Maga: No me vale creo
[9/10/23, 15:20:42] Maga: Yqs
[9/10/23, 15:20:51] Maga: Me parece de los primeros limites q hay que marcar
‎[9/10/23, 15:20:59] Antonio Murillo Sevillano: ‎<adjunto: 00001494-AUDIO-2023-10-09-15-20-59.opus>
‎[9/10/23, 15:21:16] Antonio Murillo Sevillano: ‎<adjunto: 00001495-AUDIO-2023-10-09-15-21-15.opus>
‎[9/10/23, 15:21:47] Antonio Murillo Sevillano: ‎<adjunto: 00001496-AUDIO-2023-10-09-15-21-47.opus>
‎[9/10/23, 15:22:15] Antonio Murillo Sevillano: ‎<adjunto: 00001497-AUDIO-2023-10-09-15-22-15.opus>
‎[9/10/23, 15:22:35] Antonio Murillo Sevillano: ‎<adjunto: 00001498-AUDIO-2023-10-09-15-22-34.opus>
‎[9/10/23, 17:07:13] Maga: ‎<adjunto: 00001499-AUDIO-2023-10-09-17-07-13.opus>
‎[9/10/23, 17:07:54] Maga: ‎<adjunto: 00001500-AUDIO-2023-10-09-17-07-54.opus>
[9/10/23, 17:07:54] Antonio Murillo Sevillano: Weno
[9/10/23, 17:08:02] Antonio Murillo Sevillano: Viene el 19
[9/10/23, 17:08:04] Antonio Murillo Sevillano: De octubre
[9/10/23, 17:08:23] Maga: Tio po hablalo
‎[9/10/23, 17:08:50] Maga: ‎<adjunto: 00001505-AUDIO-2023-10-09-17-08-50.opus>
‎[9/10/23, 17:09:15] Maga: ‎<adjunto: 00001506-AUDIO-2023-10-09-17-09-15.opus>
[9/10/23, 17:10:06] Antonio Murillo Sevillano: Ya
[9/10/23, 17:10:08] Antonio Murillo Sevillano: No se
[9/10/23, 17:10:18] Antonio Murillo Sevillano: Está al nivel de la q están montando x lo de la warre
[9/10/23, 17:10:38] Antonio Murillo Sevillano: Q ya tiene carnet hasta ekilio lebamnc
[9/10/23, 17:11:18] Antonio Murillo Sevillano: Si Elena sale auténtica sicologa analizará a la warre
‎[9/10/23, 17:11:22] Maga: ‎<adjunto: 00001512-AUDIO-2023-10-09-17-11-22.opus>
[9/10/23, 17:11:37] Antonio Murillo Sevillano: Yo creo q lo hace pa sentirse especial
[9/10/23, 17:11:39] Antonio Murillo Sevillano: Ya
[9/10/23, 17:11:49] Antonio Murillo Sevillano: Literalmente ya lo hace con compararlo con su Erasmus
‎[9/10/23, 17:12:23] Maga: ‎<adjunto: 00001516-AUDIO-2023-10-09-17-12-23.opus>
‎[9/10/23, 17:12:52] Maga: ‎<adjunto: 00001517-AUDIO-2023-10-09-17-12-52.opus>
[9/10/23, 17:13:23] Antonio Murillo Sevillano: Es q a mi no me cuesta tener novia de Erasmus
[9/10/23, 17:13:35] Antonio Murillo Sevillano: Tipo pa mi no es problema
[9/10/23, 17:13:39] Antonio Murillo Sevillano: Comer está sobrevalorado
‎[9/10/23, 17:13:49] Maga: ‎<adjunto: 00001521-AUDIO-2023-10-09-17-13-49.opus>
[9/10/23, 17:13:52] Antonio Murillo Sevillano: No pienso con la cabeza del pito
[9/10/23, 17:14:41] Antonio Murillo Sevillano: Ya
[9/10/23, 17:14:43] Antonio Murillo Sevillano: No se
[9/10/23, 17:14:49] Antonio Murillo Sevillano: Supongo q ocurrirá otra vez
[9/10/23, 17:14:53] Antonio Murillo Sevillano: Y ya tomaré una decisión
[9/10/23, 17:15:18] Antonio Murillo Sevillano: Pero es q en parte me da miedo hasta enseñarle cosas en mi móvil
[9/10/23, 17:15:23] Antonio Murillo Sevillano: Y eso q es inofensivo
‎[9/10/23, 17:15:26] Maga: ‎<adjunto: 00001529-AUDIO-2023-10-09-17-15-26.opus>
‎[9/10/23, 17:15:41] Maga: ‎<adjunto: 00001530-AUDIO-2023-10-09-17-15-41.opus>
[9/10/23, 17:15:59] Antonio Murillo Sevillano: Q. No es a se lo enseñe
‎[9/10/23, 17:16:02] Maga: ‎<adjunto: 00001532-AUDIO-2023-10-09-17-16-02.opus>
[9/10/23, 17:16:05] Antonio Murillo Sevillano: Es como si estamos tumbados
[9/10/23, 17:16:11] Antonio Murillo Sevillano: Y estoy con el móvil enseñándole algo
[9/10/23, 17:16:22] Antonio Murillo Sevillano: Cómo cuando el historial de instagram
[9/10/23, 17:16:35] Antonio Murillo Sevillano: Ni llegue allí y ya estaba rayada
‎[9/10/23, 17:18:56] Maga: ‎<adjunto: 00001537-AUDIO-2023-10-09-17-18-56.opus>
[9/10/23, 19:33:32] Antonio Murillo Sevillano: entonces que es lo que ves mal
[9/10/23, 19:33:40] Antonio Murillo Sevillano: quitando lo del espacio
[9/10/23, 19:33:45] Antonio Murillo Sevillano: que no confie en mi ?
[9/10/23, 19:34:13] Antonio Murillo Sevillano: a mi lo q me parece subrealista ahora con mas tiempo es que realmente crea que pueda hacerlo
[9/10/23, 19:34:29] Antonio Murillo Sevillano: y por mas que le diga que no que siga pensando lo mismo
‎[9/10/23, 20:54:22] Maga: ‎<adjunto: 00001543-AUDIO-2023-10-09-20-54-22.opus>
[9/10/23, 20:57:14] Antonio Murillo Sevillano: ya
[9/10/23, 20:57:15] Antonio Murillo Sevillano: tambn
[9/10/23, 20:57:18] Antonio Murillo Sevillano: no se es complicado
[9/10/23, 20:57:24] Antonio Murillo Sevillano: ya lo pensare cuando me duela menos el cuello
[9/10/23, 22:36:24] Antonio Murillo Sevillano: illo
[9/10/23, 22:36:30] Antonio Murillo Sevillano: tu quieres premium con esta gente?
[9/10/23, 22:36:40] Antonio Murillo Sevillano: pa deirselo o meter a otro
[10/10/23, 0:42:54] Antonio Murillo Sevillano: Ya he hablado más con maría
[10/10/23, 10:01:29] Maga: Dile que metan a otro
[10/10/23, 10:01:36] Maga: Y bien?
[10/10/23, 10:01:43] Maga: Estoy en el autobus de vuelta
[10/10/23, 10:01:49] Maga: Con una hora de sueño
